index,published,topic,term,domain,language,valid,de,title,description,en,la,url,image,archive,content,quote,added,feed,country,ipcc,continent
2c333e466ae332fdab46c8a82ac5f7f3,2026-03-04T00:57:36Z,Snow&Ice,neve acumulada,www.terra.com.br,pt,0.3,"Vergessen Sie die Megaprojekte in China: die berühmte Brücke in Brasilien, die einen kolossalen Weltrekord hält, den der Rest der Welt nie übertreffen konnte. Die vor 52 Jahren eröffnete Rio-Niterói-Brücke hält einen Weltrekord: Die mittlere Spannweite entspricht in der Höhe einem 25-stöckigen Gebäude",Esqueça as megaobras da China: a famosa ponte no Brasil que detém um colossal recorde mundial que o resto do planeta nunca conseguiu superar,"Inaugurada há 52 anos, a Ponte Rio-Niterói mantém um recorde mundial: o vão central de altura equivalente a um prédio de 25 andares","Forget the mega-projects in China: the famous bridge in Brazil that holds a colossal world record that the rest of the planet has never managed to surpass. Opened 52 years ago, the Rio-Niterói Bridge holds a world record: the central span is equivalent in height to a 25-story building","Incepta mega-in Sinarum obliviscere: pons insignis in Brasilia, qui perampla mundi tenet, memorant reliquos planetae numquam superare curasse. Ante annos 52 apertus, Pons Rio-Niterói testimonium mundi tenet: palmus centralis aequipollet altitudini 25 historiarum aedificationum.","https://www.terra.com.br/byte/esqueca-as-megaobras-da-china-a-famosa-ponte-no-brasil-que-detem-um-colossal-recorde-mundial-que-o-resto-do-planeta-nunca-conseguiu-superar,32b2105dcaac4a39d91f4db11f321da7whrdqsoj.html",https://p2.trrsf.com/image/fget/cf/1200/630/middle/images.terra.com/2026/03/04/1718446090-13662000.jpeg,,"Inaugurada em 4 de março de 1974, a Ponte Rio-Niterói, oficialmente nomeada como Ponte Presidente Costa e Silva, completa 52 anos nesta terça-feira (4) — e, mesmo depois de tantos anos, ostenta um fe… [+1939 chars]",,2026-03-15 15:38:13+00:00,random,,,
0dea05aed332d59afd0b51f56710db3b,2026-03-07T17:39:50Z,Drought,seca angola,www.revistabula.com,pt,0.3,"Einer der am meisten ausgezeichneten brasilianischen Filme der Geschichte und der am meisten erwartete des Jahres 2026 ist gerade auf Netflix eingetroffen. Kleber Mendonça Filho nimmt Wagner Moura mit nach Recife während des Karnevals 1977, um einem Mann zu folgen, der von Archiven, aufmerksamen Nachbarn und Geheimräumen umgeben ist. „The Secret Agent“ folgt dem Versuch, seinen Sohn wiederzusehen, während in der Stadt Partys, Gerüchte und Gewalt gemischt werden …","Um dos filmes brasileiros mais premiados da história, e o mais aguardado de 2026, acaba de chegar à Netflix","Kleber Mendonça Filho leva Wagner Moura ao Recife do Carnaval de 1977 para seguir um homem cercado por arquivos, vizinhos atentos e quartos clandestinos. “O Agente Secreto” acompanha a tentativa de rever o filho enquanto a cidade mistura festa, boato e violên…","One of the most awarded Brazilian films in history, and the most anticipated of 2026, has just arrived on Netflix. Kleber Mendonça Filho takes Wagner Moura to Recife during the 1977 Carnival to follow a man surrounded by archives, attentive neighbors and clandestine rooms. “The Secret Agent” follows the attempt to see his son again while the city mixes parties, rumors and violence…","Una cinematographica Brasiliana maxime considerata in historia, et anticipata 2026, modo venit in Netflix. Kleber Mendonça Filho Wagner Moura ad Recife in anno 1977 Carnival accipit ut hominem archivis circumdatum, attentis vicinis et clandestinis cubiculis comprehendat. ""Secretum agens"" sequitur conatum filium suum iterum videndi dum partes, rumores et violentiam miscet civitas.",https://www.revistabula.com/156154-um-dos-filmes-brasileiros-mais-premiados-da-historia-e-o-mais-aguardado-de-2026-acaba-de-chegar-a-netflix/,https://www.revistabula.com/wp/wp-content/uploads/2026/03/O-Agente-Secreto-1.webp,,"Kleber Mendonça Filho abre O Agente Secreto com um homem tentando sumir no Recife do Carnaval de 1977. Interpretado por Wagner Moura, Marcelo chega à cidade para encontrar abrigo, rever o filho e esc… [+3293 chars]",,2026-03-15 20:40:38+00:00,edo,Angola,WSAF,Africa
850132966f60d8072ee82abf1ccd8676,2026-03-09T00:36:31Z,Tropical Cyclone,ciclone tropical ilhas áridas a leste,www.adorocinema.com,pt,0.3,"Wenn Sie „Breaking Bad“ mit „Brooklyn Nine-Nine“ kombinieren, steht Ihnen dieser faszinierende Thriller im Stream zur Verfügung. Diese Miniserie mit Wagner Moura in der Hauptrolle ist in der Lage, das dramatische und komische Leben von Polizisten zu vermischen, genau wie in der berühmtesten Serie in der Geschichte des Fernsehens.",Se você misturar Breaking Bad com Brooklyn Nine-Nine terá este thriller fascinante disponível no streaming,"Estrelado por Wagner Moura, essa minissérie é capaz de misturar a vida dramática e cômica de policiais, assim como nas séries mais famosas da história da televisão.","If you mix Breaking Bad with Brooklyn Nine-Nine you will have this fascinating thriller available on streaming. Starring Wagner Moura, this miniseries is capable of mixing the dramatic and comical lives of police officers, just like in the most famous series in the history of television.","Si fracturam Malum cum Brooklyno Novem-Novem misces, habebis hoc attrahenti thriller in effusis praesto. Wagner Moura stellantes, haec ministeria possunt miscere vitas dramaticas et ridiculas ministrorum vigilum, sicut in serie celeberrima in historia televisificarum.",https://www.adorocinema.com/noticias/series/noticia-1000192853/,https://p2.trrsf.com/image/fget/cf/1200/630/middle/images.terra.com/2026/03/09/465886155-e9bd7e9e68818b61cdc10596ff341f36.png,,"Em poucas semanas, estaremos diante da premiação mais aguardada do cinema: o Oscar. E por essa razão, ter a oportunidade de assistir aos concorrentes em outros trabalhos é algo imprescindível para qu… [+1544 chars]",,2026-03-15 20:40:38+00:00,wmo,United States,CNA,North-America
fc7268e24d9cb17f26c8281186c55768,2026-03-02T11:48:44Z,Drought,seca moçambique,observador.pt,pt,0.3,"Holz. Bewegung am Flughafen durch den Wind. An diesem Montag um 9.30 Uhr waren bereits 26 Ankünfte und 24 Abflüge storniert worden. IPMA prognostiziert Windböen, die in den Hochgebieten der Insel Geschwindigkeiten von 80 km/h und 110 km/h erreichen könnten.",Madeira. Movimento no aeroporto condicionado devido ao vento,"Às 9h30 desta segunda-feira já estavam canceladas 26 chegadas e 24 partidas. IPMA prevê rajadas de vento que podem chegar aos 80km/h, 110km/h nas zonas altas da ilha.","Wood. Movement at the airport due to the wind. At 9:30 am this Monday, 26 arrivals and 24 departures had already been cancelled. IPMA predicts wind gusts that could reach 80km/h, 110km/h in the high areas of the island.","Lignum. Motus in aeroportus propter venti. Ad 9:30 hoc Lunae, 26 adventus et 24 discessus iam abrogato sunt. IPMA praedicit procellas venti quae 80km/h, 110km/h in altissimis insulae locis attingere possunt.",https://observador.pt/2026/03/02/movimento-no-aeroporto-da-madeira-condicionado-dezenas-de-voos-cancelados-devido-ao-mau-tempo/,https://wm.observador.pt/wm/l/https%3A%2F%2Fbordalo.observador.pt%2Fv2%2Frs%3Afill%3A770%3A403%2Fc%3A2000%3A1124%3Anowe%3A0%3A104%2Fq%3A70%2Ff%3Awebp%2Fplain%2Fhttps%3A%2F%2Fs3.observador.pt%2Fwp-content%2Fuploads%2F2022%2F05%2F09230036%2F18389043.jpg?layer=obstop:T,,"O movimento no Aeroporto Internacional da Madeira está esta segunda-feira a ser condicionado por condições meteorológicas adversas, tendo sido cancelados já 50 voos.
Segundo informação disponibiliza… [+1882 chars]",,2026-03-16 03:28:17+00:00,edo,Mozambique,ESAF,Africa
902d2dd12a37ca988168303135dbb09f,2026-03-04T11:28:52Z,Heat Wave,calor,ultimosegundo.ig.com.br,pt,0.9,"Die Wärmeblase muss den SP-Zustand erreichen; das Phänomen verstehen. Heiße Luftmassen, die zwischen Argentinien und Paraguay strömen, strömen über das Territorium und die Temperaturen können im Landesinneren von São Paulo 38 °C erreichen",Bolha de calor deve atingir o estado de SP; entenda o fenômeno,Massa de ar quente que atua entre Argentina e Paraguai avança sobre o território e temperaturas podem chegar a 38°C no interior paulista,Heat bubble must reach SP state; understand the phenomenon. Hot air mass that operates between Argentina and Paraguay advances over the territory and temperatures can reach 38°C in the interior of São Paulo,"Calor bullae SP status debet pervenire; phaenomenon intellige. Massa aeris calida, quae inter Argentinam et Paraguay operans progressus in territorium et temperaturas 38°C in mediterraneo São Paulo pervenire potest.",https://ultimosegundo.ig.com.br/2026-03-04/bolha-de-calor-deve-atingir-o-estado-de-sp--entenda-o-fenomeno.html,https://i0.statig.com.br/bancodeimagens/3b/5w/l6/3b5wl6gug3wppgo98i31o6w6j.jpg,,Um fenômeno climático que atua entre a Argentina e o Paraguai começa a avançar em direção ao Brasil nesta quarta-feira (04) e deve trazer altas temperaturas por pelo menos cinco dias. A previsão indi… [+1962 chars],,2026-03-16 11:05:31+00:00,random,,,
b4a0f2573c0b0c372236a5d217788e89,2026-03-02T13:32:10Z,Heat Wave,calor,olhardigital.com.br,pt,0.9,"El Niño könnte im Jahr 2026 zurückkehren und die globale Hitze verstärken. NOAA geht davon aus, dass die Wahrscheinlichkeit von El Niño zwischen Juli und September bei bis zu 60 % liegt, mit der Gefahr neuer Temperaturrekorde in den Jahren 2026 und 2027
Der Beitrag „El Niño könnte im Jahr 2026 zurückkehren und die globale Hitze verstärken“ erschien zuerst auf Olhar Digital.",El Niño pode voltar em 2026 e elevar calor global,"NOAA aponta até 60% de chance de El Niño entre julho e setembro, com risco de novos recordes de temperatura em 2026 e 2027
O post El Niño pode voltar em 2026 e elevar calor global apareceu primeiro em Olhar Digital.","El Niño could return in 2026 and increase global heat. NOAA points to up to a 60% chance of El Niño between July and September, with a risk of new temperature records in 2026 and 2027
The post El Niño could return in 2026 and increase global heat appeared first on Olhar Digital.","El Niño anno 2026 reverti potuit et globalem calorem augere. NOAA demonstrat usque ad 60% casum El Niño inter Iulium et Septembrem, cum periculo novorum temperaturarum monumentis anno 2026 et 2027
Post El Niño anno 2026 reverti potuit et calor globalis augendus primus in Olhar Digital apparuit.",https://olhardigital.com.br/2026/03/02/ciencia-e-espaco/el-nino-pode-voltar-em-2026-e-elevar-calor-global/,https://olhardigital.com.br/wp-content/uploads/2024/11/PADRAO-OD-4-scaled.jpg,,"Siga o Olhar Digital no Google Discover
A possível volta do El Niño ainda em 2026 pode elevar novamente as temperaturas globais e contribuir para novos recordes de calor. Segundo a National Oceanic … [+3122 chars]",,2026-03-16 20:51:34+00:00,random,,,
3ae6e3a5ade5016e205223b4582b6ea0,2026-03-16T16:17:15Z,Tropical Cyclone,ciclone tropical horacio,observador.pt,pt,0.3,"IPMA gibt gelbe Warnungen für Madeira heraus. Die Warnung vor Meeresstörungen ist zwischen 15:00 Uhr am Mittwoch und 12:00 Uhr am Donnerstag aktiv und deckt die Nord- und Südküste von Madeira und Porto Santo ab, wobei Wellen von bis zu fünf Metern erwartet werden.",IPMA emite avisos amarelos para a Madeira,"O aviso de agitação marítima está ativo entre as 15h00 de quarta-feira e as 12h00 de quinta-feira, abrangendo as costas norte e sul da Madeira e Porto Santo, com a previsão de ondas até cinco metros.","IPMA issues yellow warnings for Madeira. The sea disturbance warning is active between 3pm on Wednesday and 12pm on Thursday, covering the north and south coasts of Madeira and Porto Santo, with waves of up to five meters expected.","Ipma monita flava prodit pro Madeirae. Commotio maris admonitio activa est inter 3pm die Mercurii et 12pm die Iovis, oras Madeirae et Porto Santo septentrionem et meridionalem operiens, cum fluctus usque ad quinque metra expectat.",https://observador.pt/2026/03/16/ipma-emite-avisos-amarelos-para-precipitacao-e-agitacao-maritima-para-a-madeira/,https://wm.observador.pt/wm/l/https%3A%2F%2Fbordalo.observador.pt%2Fv2%2Frs%3Afill%3A770%3A403%2Fc%3A2000%3A1124%3Anowe%3A0%3A105%2Fq%3A70%2Ff%3Awebp%2Fplain%2Fhttps%3A%2F%2Fs3.observador.pt%2Fwp-content%2Fuploads%2F2023%2F02%2F17014409%2F31043372.jpg?layer=obstop:T,,"O Instituto Português do Mar e da Atmosfera (IPMA) emitiu esta segunda-feira avisos amarelos para o arquipélago da Madeira devido às previsões de precipitação e agitação marítima.
Segundo o IPMA, na… [+590 chars]",,2026-03-18 06:08:00+00:00,eonet,,SIO,Indian Ocean
e0acab3dc7b19c74ee2ef8a1e3e7db04,2026-03-16T22:45:57Z,Precipitation,chuva porto,observador.pt,pt,0.9,"Der Katastrophenschutz von Madeira warnt vor Regen und Wind. Bis Freitag ist mit stark bewölktem Himmel zu rechnen, mit teils heftigen Schauern und Gewittern an der Nord- und Südküste, in den Bergregionen und auf der Insel Porto Santo.",Proteção Civil da Madeira alerta para chuva e vento,"Até sexta-feira estão previstos períodos de céu muito nublado, com aguaceiros, por vezes fortes e acompanhados de trovoada nas costas norte, sul, regiões montanhosas e ilha do Porto Santo.","Madeira Civil Protection warns of rain and wind. Periods of very cloudy skies are expected until Friday, with showers, sometimes heavy and accompanied by thunderstorms on the north and south coasts, mountainous regions and the island of Porto Santo.","Madeira Civil Protection monet pluvias et ventos. Tempora caelorum nubilum exspectantur usque ad diem Veneris, cum imbribus, interdum gravibus et cum tonitribus, in oram septentrionis et australis, montana et insula Porto Santo.",https://observador.pt/2026/03/16/protecao-civil-da-madeira-alerta-para-chuva-e-vento-devido-a-passagem-da-depressao-therese/,https://wm.observador.pt/wm/l/https%3A%2F%2Fbordalo.observador.pt%2Fv2%2Frs%3Afill%3A770%3A403%2Fc%3A770%3A433%3Anowe%3A0%3A0%2Fq%3A70%2Ff%3Awebp%2Fplain%2Fhttps%3A%2F%2Fs3.observador.pt%2Fwp-content%2Fuploads%2F2020%2F09%2F17103323%2F23793413_770x433_acf_cropped.jpg?layer=obstop:T,,"A Proteção Civil da Madeira alertou esta segunda-feira para o agravamento das condições meteorológicas a partir de quarta-feira, altura em que o arquipélago será afetado pela depressão Therese, com c… [+1831 chars]",,2026-03-18 06:08:00+00:00,wmo,Portugal,MED,Europe
af052a5ebdbe2b5ddf552bdd01c7c8d7,2026-03-04T11:26:24Z,Thunderstorm,granizo ilhas do sul de vanuatu,catracalivre.com.br,pt,0.3,"So erhalten Sie mit nur Ihren Händen und einem Haartrockner Promi-Haarwurzelvolumen. Möchten Sie wissen, wie Sie Volumen am Haaransatz bekommen, ohne Zeit vor dem Spiegel zu verschwenden? Entdecken Sie die Tricks für zu Hause, die schlaffe Strähnen in wenigen Minuten in einen Salon-Look verwandeln. Der Beitrag „Wie man bei Prominenten nur mit den Händen und einem Haartrockner Volumen an den Haarwurzeln bekommt“ erschien zuerst und…",Como ter o volume na raiz das celebridades usando apenas as mãos e o secador,"Quer saber como ter volume na raiz sem perder tempo no espelho? Descubra os truques caseiros que transformam fios murchos em um visual de salão em minutos.
O post Como ter o volume na raiz das celebridades usando apenas as mãos e o secador apareceu primeiro e…","How to get celebrity root volume using just your hands and a hairdryer. Want to know how to get volume at the roots without wasting time in the mirror? Discover the at-home tricks that transform limp strands into a salon look in minutes.
The post How to get volume at the roots of celebrities using just your hands and a hairdryer appeared first and…","Quam ut celebritatem voluminis radicis adipiscamur, manibus tuis tantum et frixoriis utendo. Vis scire radicem volumen obtinere sine tempore in speculo? Cautiones domi detege quae inter fila solutas in salon per minutas formas transformat.
Postes Quomodo volumen ad radices celebritatum utendo manus tuas tantum et fēnsarius primus apparuit et…",https://catracalivre.com.br/saude-bem-estar/como-ter-o-volume-na-raiz-das-celebridades-usando-apenas-as-maos-e-o-secador/,https://i.catracalivre.com.br/HAoQz4yyFyFQD6E7hKqn64h1sn4=/1200x630/smart/filters:quality(60)/catracalivre.com.br/wp-content/uploads/2026/03/creation-2501356170.png,,"Em meio à rotina acelerada, muitas pessoas procuram formas rápidas de cuidar da aparência sem depender de longas sessões em frente ao espelho. O cabelo, especialmente a região da raiz, costuma ser um… [+5618 chars]",,2026-03-18 11:01:00+00:00,wmo,Vanuatu,SPO,Oceania
34640f927afa1526a3da6e49cf6a2388,2026-03-11T10:19:43Z,Precipitation,aguaceiro vanuatu,news.samsung.com,pt,0.3,"Samsung beginnt mit der Auslieferung der Galaxy S26-Serie in Brasilien. Ab diesem Mittwoch (11) wird Samsung mit der Auslieferung der neuen Galaxy S26-Serie an brasilianische Verbraucher beginnen, die die Smartphones bereits gekauft haben. DER",Samsung inicia entregas da Galaxy S26 Series no Brasil,"A Samsung inicia, a partir desta quarta-feira (11), o envio da nova Galaxy S26 Series aos consumidores brasileiros que já adquiriram os smartphones. O","Samsung begins deliveries of the Galaxy S26 Series in Brazil. Starting this Wednesday (11), Samsung will begin shipping the new Galaxy S26 Series to Brazilian consumers who have already purchased the smartphones. THE","Product incipit traditiones galaxia S26 Series in Brasilia. Incipiens hoc Mercurii (11), Samsung incipiet de naviculas novas Galaxy S26 Series ad perussores Brasilienses qui iam smartphones emerunt. THE",https://news.samsung.com/br/samsung-inicia-entregas-do-galaxy-s26-series-no-brasil,https://img.global.news.samsung.com/br/wp-content/uploads/2026/03/005-product-galaxy-s26ultra-cobaltviolet-black-skyblue-white-1-e1773233172303.jpg,,"A Samsung inicia, a partir desta quarta-feira (11), o envio da nova Galaxy S26 Series aos consumidores brasileiros que já adquiriram os smartphones. O início das entregas coincide com o lançamento gl… [+9592 chars]",,2026-03-18 11:01:00+00:00,wmo,Vanuatu,SPO,Oceania
b76e39a7edbd80bc9df7c2cf2dec6107,2026-03-11T22:17:29Z,Precipitation,chuva torrencial,observador.pt,pt,0.3,"Das Problem war nicht synthetisch, sondern analytisch. Alles, was schief gehen konnte, ging noch schlimmer. Aber nein, es gab keinen Murphy, der Sporting angriff. Die Spielregeln dieses Bodö/Glimt sind sehr klar, aber die Löwen haben es nie verstanden (3:0).","O problema não foi o sintético, foi o analítico","Tudo o que podia correr mal, correu ainda pior. Mas não, não houve nenhum Murphy a abater-se sobre o Sporting. É que a lei deste Bodö/Glimt em campo é muito clara mas os leões nunca perceberam (3-0).","The problem was not synthetic, it was analytical. Everything that could go wrong, went even worse. But no, there was no Murphy attacking Sporting. The law of this Bodö/Glimt on the field is very clear but the lions never understood (3-0).","Quaestio non synthetica, analytica fuit. Omnia, quae errare potuerunt, peiora fuerunt. Sed nulla Murphy oppugnans Sporting non erat. Lex huius Bodö/Glimt in agro clarissima est sed leones numquam intellexerunt (3-0).",https://observador.pt/2026/03/11/eles-foram-superlativos-mas-o-problema-nao-foi-o-sintetico-foi-o-analitico-a-cronica-do-bodo-glimt-sporting/,https://wm.observador.pt/wm/l/https%3A%2F%2Fbordalo.observador.pt%2Fv2%2Frs%3Afill%3A770%3A403%2Fc%3A1500%3A842%3Anowe%3A0%3A116%2Fq%3A70%2Ff%3Awebp%2Fplain%2Fhttps%3A%2F%2Fs3.observador.pt%2Fwp-content%2Fuploads%2F2026%2F03%2F11220816%2Fbodo-glimt-sporting.jpg?layer=obstop:T,,"Tudo é diferente num encontro a contar para os oitavos da Liga dos Campeões, tudo era ainda mais diferente na deslocação do Sporting a Bodö, pequena cidade norueguesa com um número de habitantes que … [+14572 chars]",,2026-03-18 11:01:00+00:00,random,,,
95fdb1a38b1bd353acf75cd55909b406,2026-03-12T14:03:32Z,Drought,seca cabo verde,www.terra.com.br,pt,0.3,Mit Regen und 3 Unfällen verzeichnet SP am Morgen Rekordstaus. Die Stadt São Paulo hat an diesem Donnerstag morgens einen neuen Stau-Rekord gebrochen – ...,"Com chuva e 3 acidentes, SP registra recorde de congestionamento pela manhã",A cidade de São Paulo bateu novo recorde de congestionamento no período da manhã nesta quinta- ...,"With rain and 3 accidents, SP records record congestion in the morning. The city of São Paulo broke a new record for congestion in the morning this Thursday - ...","Cum pluvia et 3 accidentibus, SP record obstructio in mane commemorat. Urbs São Paulo novum testimonium perrupit ob obstructionem mane huius Iovis - ...","https://www.terra.com.br/planeta/noticias/com-chuva-e-3-acidentes-sp-registra-recorde-de-congestionamento-pela-manha,fece4d3aebf95e7ca8172019ea356c98kviphddw.html",https://p2.trrsf.com/image/fget/cf/1200/630/middle/images.terra.com/2026/03/12/1513058004-67fyemvpxbcehbpxxkps5r7npu.jpg,,"A cidade de São Paulo bateu novo recorde de congestionamento no período da manhã nesta quinta-feira, 12, com 1.059 km de lentidão registrado às 8h, segundo a Companhia de Engenharia de Trafego (CET).… [+1911 chars]",,2026-03-18 11:01:00+00:00,edo,Cabo Verde,NAO,Atlantic Ocean
d42858191e2d63b2e36c10e4d6f10650,2026-03-15T11:18:42Z,Drought,falta de chuva Guiné Bissau,www.purepeople.com.br,pt,0.3,"Ich bin Filmkritiker und ich garantiere: Diese Dramen sind vom Publikum in Vergessenheit geraten, aber sie gehören zu den besten Serien, die jemals in Südkorea gedreht wurden. Machen Sie sich bereit, Dramen noch einmal zu erleben, die auch außerhalb des aktuellen Rampenlichts weiterhin den Höhepunkt dessen darstellen, was Südkorea zu bieten hat","Sou crítico de cinema e garanto: esses doramas foram esquecidos pelo público, mas são algumas das melhores séries já feitas na Coreia do Sul","Prepare-se para revisitar doramas que, mesmo fora dos holofotes atuais, continuam sendo o auge do que a Coreia do Sul tem a oferecer","I'm a film critic and I guarantee: these dramas have been forgotten by the public, but they are some of the best series ever made in South Korea. Get ready to revisit dramas that, even out of the current spotlight, continue to be the pinnacle of what South Korea has to offer","Im pelliculae criticae et spondeo: hae fabulae publicae oblivioni traditae sunt, sed quaedam optimae series semper in Corea Meridiana factae sunt. Parate dramata revisere quae, etiam ex arcu currenti, fastigium futurum esse quod Corea Meridiana offerat.", https://www.purepeople.com.br/noticia/sou-critico-de-cinema-e-garanto-esses-doramas-foram-esquecidos-pelo-publico-mas-sao-perfeitos-e-valem-cada-segundo-da-maratona_a417557/1 ,https://p2.trrsf.com/image/fget/cf/1200/630/middle/images.terra.com/2026/03/15/1828478984-77a26d6c5dbc2167-1400x823-1.jpg,,"A Coreia do Sul já entregou doramas que foram fenômenos de verdade e agradaram tanto o público quanto a crítica. Alguns dominaram as redes sociais, viralizaram, ganharam prêmios, viraram referência e… [+1990 chars]",,2026-03-18 11:01:00+00:00,edo,Guinea-Bissau,WAF,Africa
a5f9d26bde5c9eae63688b1407ec237b,2026-03-16T09:00:54Z,Tropical Cyclone,ciclone austrália,turismo.ig.com.br,pt,0.3,"Schauen Sie sich die 10 am häufigsten gesuchten Reiseziele für Busreisen an. Eine Umfrage von Platform 10 ergab, dass Strände im letzten Jahr die Hauptsuchanfragen bei Google Brasilien anführten",Confira os 10 destinos mais pesquisados para viajar de ônibus,Levantamento da Plataforma 10 revelou que as praias lideram as principais buscas feitas no Google Brasil no último ano,Check out the 10 most searched destinations for traveling by bus. Survey by Platform 10 revealed that beaches lead the main searches made on Google Brazil in the last year,Check out the 10 most searched destinations for travel by bus. Contemplatio a Rostris 10 revelatum est litora ducere inquisitiones principales in Google Brasiliae proximo anno factas,https://turismo.ig.com.br/colunas/vitor-vianna/2026-03-16/confira-os-10-destinos-mais-pesquisados-para-viajar-de-onibus.html,https://i0.statig.com.br/bancodeimagens/a1/jt/b5/a1jtb569vvk9jtkfwcfzo2xv7.jpg,,Viajar de ônibus segue sendo uma das formas mais comuns utilizadas pelos brasileiros que desejam conhecer novos destinos ou visitar regiões turísticas pelo país. Esse cenário fica claro ao observar o… [+5255 chars],,2026-03-18 11:01:00+00:00,aidr,Australia,CAU,Oceania
31b4cb54b4a2cb07a242876605c87dbb,2026-03-16T12:42:30Z,Storm,tempestade madeira costa norte,rollingstone.com.br,pt,0.3,"Oscars 2026: beste, schlechteste und zufälligste Momente. Es war eine instabile Show voller kleiner Produktionsfehler und wenigen Überraschungen. Zumindest war Conan da, um uns zum Lachen zu bringen","Oscars 2026: melhores, piores e mais aleatórios momentos","Foi um show instável, cheio de pequenos tropeços de produção e poucas surpresas. Pelo menos Conan estava lá para nos fazer rir","Oscars 2026: best, worst and most random moments. It was an unstable show, full of small production missteps and few surprises. At least Conan was there to make us laugh","Oscars 2026: optimi, pessimi et incerti momenti. Erat spectaculum instabile, plena parvae productionis errorum et pauci insidiarum. Conanus certe erat ut rideamus",https://rollingstone.com.br/cinema/oscars-2026-melhores-piores-e-mais-aleatorios-momentos/,https://p2.trrsf.com/image/fget/cf/1200/630/middle/images.terra.com/2026/03/16/939674781-conan-obrien-kevin-winter-getty-images-foto-jornalistica-2266731037.jpg,,"De um jeito ou de outro, o Oscar quase sempre é meio arrastado. Simplesmente não há como tornar um programa de três horas e meia realmente agradável do começo ao fim. Mas a transmissão deste ano foi … [+10070 chars]",,2026-03-18 11:01:00+00:00,wmo,Portugal,MED,Europe
