index,published,topic,term,domain,language,valid,de,title,description,en,la,url,image,archive,content,quote,added,feed,country,ipcc,continent
d36dd4291ea980e657efc2b262f8401c,2026-05-02T01:00:25Z,Precipitation,chuva recorde,catracalivre.com.br,pt,0.9,"Der niederländische Trick, um an regnerischen Tagen nasse Kleidung in Rekordzeit zu trocknen. Mit diesem einfachen Trick kann das Trocknen von Kleidung an regnerischen Tagen einfacher sein. Verstehen Sie, wie es funktioniert und warum es funktioniert.
Der Beitrag Der niederländische Trick, nasse Kleidung an regnerischen Tagen in Rekordzeit zu trocknen, erschien zuerst auf Catraca Livre.",O truque holandês para secar roupa molhada em tempo recorde em dias de chuva,"Secar roupa em dias de chuva pode ser mais fácil com esse truque simples. Entenda como funciona e por que dá certo.
O post O truque holandês para secar roupa molhada em tempo recorde em dias de chuva apareceu primeiro em Catraca Livre.","The Dutch trick for drying wet clothes in record time on rainy days. Drying clothes on rainy days can be easier with this simple trick. Understand how it works and why it works.
The post The Dutch trick for drying wet clothes in record time on rainy days appeared first on Catraca Livre.","Dolus Hollandi ad siccandas vestes humidas in recordo tempore pluvioso dierum. Pluviis diebus vestimenta siccare facilius hoc dolus simplex potest. Intellige quomodo operatur et quare operatur.
Praecipua fraus Batavica de vestimentis humidis siccendis in recordo tempore pluvioso tempore apparuit primum in Catraca Livre.",https://catracalivre.com.br/noticias/o-truque-holandes-para-secar-roupa-molhada-em-tempo-recorde-em-dias-de-chuva/,https://i.catracalivre.com.br/fFQ8LiX5H15efZApTbzKUXpcC14=/1200x630/smart/filters:quality(60)/catracalivre.com.br/wp-content/uploads/2026/05/magnific-bolsa-termica-com-agua-qu-2901014403.jpg,,"Secar roupas em dias de chuva costuma ser um desafio, principalmente em ambientes pequenos e com pouca circulação de ar. A gente pendura tudo, espera, espera e as peças continuam úmidas, demorando um… [+4762 chars]",,2026-05-03 07:23:14+00:00,random,,,
922f8080765733e0042d63c7929479c9,2026-05-02T11:07:26Z,Drought,evapotranspiração,catracalivre.com.br,pt,0.9,"Wissenschaftler sind schockiert: Den Pflanzen in Colorado gehen im Sommer aufgrund extremer Dürre die Wasserreserven aus. Colorados Vegetation verstärkt die Evapotranspiration im Sommer und erschöpft das Grundwasser. Verstehen Sie die Auswirkungen von Dürre auf lebenswichtige Wassereinzugsgebiete.
Der Beitrag Wissenschaftler sind schockiert: Den Pflanzen in Colorado gehen im Sommer die Wasserreserven aus, weil…",Cientistas estão chocados: as plantas do Colorado estão ficando sem reservas de água no verão devido à seca extrema,"A vegetação do Colorado intensifica a evapotranspiração no verão e esgota águas subterrâneas. Entenda o impacto da seca nas bacias hidrográficas vitais.
O post Cientistas estão chocados: as plantas do Colorado estão ficando sem reservas de água no verão devid…","Scientists are shocked: Colorado plants are running out of water reserves in the summer due to extreme drought. Colorado's vegetation intensifies summer evapotranspiration and depletes groundwater. Understand the impact of drought on vital watersheds.
The post Scientists are shocked: Colorado plants are running out of water reserves in the summer due to…","Stupent physici: Colorado plantae ex subsidiis aquae aestate currunt ob nimiam siccitatem. Vegetatio Colorado auget evapotranspirationem aestivam et defundit aquam terram. Ictum siccitatis in aquis vitalibus intellige.
Scientistae post stupent: plantae Colorado currunt ex subsidiis aquae aestate propter ...",https://catracalivre.com.br/noticias/cientistas-estao-chocados-as-plantas-do-colorado-estao-ficando-sem-reservas-de-agua-no-verao-devido-a-seca-extrema/,https://i.catracalivre.com.br/nE9iN_LKN154r3n0czHJAnV2Lrw=/1200x630/smart/filters:quality(60)/catracalivre.com.br/wp-content/uploads/2026/05/magnific-leito-do-rio-colorado-com-2901189409.jpg,,"Um silencioso e preocupante desafio toma conta da bacia do Rio Colorado, onde a vegetação nativa está consumindo drasticamente as reservas de água durante os períodos de verão extremo. Um estudo rece… [+5974 chars]",,2026-05-03 15:56:45+00:00,random,,,
1130f0038f2cb0a20aa412ff054eba54,2026-05-02T21:43:42Z,Storm,tempestade santarém,observador.pt,pt,0.3,"Wiedergeburt des Drachen. Die Klänge des 31. Treffers des FC Porto. Ein Marathon, der von Fariolis Verteidigungsmauer gewonnen wurde. Es gab starke Verstärkungen, Präsidentenkriege und einen herzlichen Abschied vom ewigen Kapitän. Erinnern Sie sich an die Klänge der 31. Meisterschaftssaison des FC Porto.",O Renascimento do Dragão. Os sons do 31 do FC Porto,"Uma maratona ganha pela muralha defensiva de Farioli. Houve reforços de peso, guerras presidenciais e o adeus sentido ao eterno capitão. Relembre os sons da época do 31º campeonato do FC Porto.","Dragon Rebirth. The sounds of FC Porto's 31. A marathon won by Farioli's defensive wall. There were heavy reinforcements, presidential wars and a heartfelt goodbye to the eternal captain. Remember the sounds of FC Porto's 31st championship season.","Draco Rebirth. Soni FC Porti 31. Marathon vici Farioli muro defensus. Auxilia gravia fuerunt, praesidentialia bella et aeternum ducem cordialiter vale. Memento sonorum FC Portuensis pilae 31 temporis.",https://observador.pt/programas/emissao-especial/o-renascimento-do-dragao-os-sons-do-31-do-fc-porto/,https://bordalo.observador.pt/v2/rs:fill:770:403/c:1600:898:nowe:0:44/q:70/f:webp/plain/https://s3.observador.pt/wp-content/uploads/2026/05/02220742/whatsapp-image-2026-05-02-at-230600.jpeg,,"Esta transcrição foi gerada automaticamente por Inteligência Artificial e pode conter erros ou imprecisões.Futebol Clube do Porto e Al Ahli dizem adeus ao Mundial de Clubes.
Termina a partida, termi… [+8331 chars]",,2026-05-04 11:59:10+00:00,wmo,Portugal,MED,Europe
6ccd831b9f164ede47206d8369997d42,2026-05-03T11:16:55Z,Tropical Cyclone,ciclone,www.metropoles.com,pt,0.9,"Wetter: Im Nordosten regnet es weiterhin und im Süden trifft eine Kaltfront; Hör zu. Der Zug des außertropischen Wirbelsturms durch das Land führt auch an diesem Sonntag zu Klimaveränderungen, insbesondere im Süden und Südosten Brasiliens",Clima: chuvas continuam no Nordeste e frente fria atinge Sul; confira,"Passagem do ciclone extratropical pelo país ainda causa mudanças climáticas neste domingo, especialmente no Sul e Sudeste do Brasil","Weather: rains continue in the Northeast and a cold front hits the South; check it out. The extratropical cyclone's passage through the country still causes climate changes this Sunday, especially in the South and Southeast of Brazil","Tempestas: imbres in Oriente pergunt et frigora ante meridiem ferit; coerceret. Transitus cyclonis extratropici per regionem adhuc mutat climata hac die, praesertim ad meridiem et meridiem Brasiliae.",https://www.metropoles.com/brasil/clima-chuvas-continuam-no-nordeste-e-frente-fria-atinge-sul-confira,https://i.metroimg.com/HQHuQ1bM3U7AvJ1yrsSpj9vL7dK_LxWFKHIKn0ygdrk/w:1200/q:90/f:webp/plain/https://images.metroimg.com/de9777e0-clima-df.jpg,,"Após os últimos dias serem marcados por chuva extrema no Nordeste, especialmente em Recife e região metropolitana da capital de Pernambuco, o cenário começa a mudar no estado neste domingo (3/5). A i… [+2427 chars]",,2026-05-04 16:56:45+00:00,random,,,
4d4472157957b2a53f11145704b55a2e,2026-05-02T23:07:00Z,Storm,tempestade no reino unido,observador.pt,pt,0.3,"Mutiger Tanz einiger Helden. Könnte jeder, den Pedro Nuno Santos zum Kampf aufruft, auch von der anderen Seite des Plenarsaals kommen, und könnte André Ventura zu den furchtlosen Nicht-Taktikisten gezählt werden, die die Zeit erfordert?",Brava dança de uns heróis,"Será que os todos que Pedro Nuno Santos convoca a combate poderão também vir do outro lado do hemiciclo, e que nos destemidos não-tacticistas que os tempos pedem se poderá incluir André Ventura?","Brave dance of some heroes. Could everyone that Pedro Nuno Santos calls for combat also come from the other side of the hemicycle, and could André Ventura be included among the fearless non-tacticalists that the times require?","Fortis aliquorum heroum chorus. Num omnes, qui Pedro Nuno Santos ad pugnam vocat, etiam ex altera parte hemicycli venire possunt, et André Ventura inter intrepidos non-tactacostas includi, quae tempora requirunt?",https://observador.pt/opiniao/brava-danca-de-uns-herois/,https://wm.observador.pt/wm-op/wide-circle/https%3A%2F%2Fbordalo.observador.pt%2Fv2%2Frs%3Afill%3A900%2Fc%3A628%3A628%3Anowe%3A27%3A50%2Fq%3A70%2Ff%3Awebp%2Fplain%2Fhttps%3A%2F%2Fs3.observador.pt%2Fwp-content%2Fuploads%2F2026%2F02%2F02212730%2Fha1.jpeg,,"Pedro Nuno Santos regressou; e não o fez sem se fazer anunciar. Na passada quarta-feira, após ausência de 6 meses, irrompeu Parlamento adentro com propósito, pujança, e direito a flash interview.
Em… [+5374 chars]",,2026-05-05 03:41:38+00:00,wmo,United Kingdom,NEU,Europe
c3c03cd6ca0acbeb4240f7dd8e899df5,2026-05-02T18:01:09Z,Precipitation,chuva brasil,www.terra.com.br,pt,0.7,"NASCAR Brasilien: Gabriel Casagrande holt sich die Pole-Position in Cascavel. Regenverzögerungen, Streckenstrategie und Strafen für übermäßig lange Rundenzeiten prägen die Sitzung. Casagrande übernimmt die Ehrenposition",NASCAR Brasil: Gabriel Casagrande conquista a pole position em Cascavel,"Atraso por chuva, estratégia de pista e punições por excesso de voltas marcam a sessão. Casagrande herda a posição de honra","NASCAR Brazil: Gabriel Casagrande wins pole position in Cascavel. Rain delays, track strategy and penalties for excessive laps mark the session. Casagrande inherits the position of honor","NASCAR Brazil: Gabriel Casagrande situm polum vincit in Cascavel. Pluet moras, semita consilii et poenae in gremiis nimiae sessionis signate. Casagrande locum honoris possidet","https://www.terra.com.br/esportes/automobilismo/nascar-brasil-gabriel-casagrande-conquista-a-pole-position-em-cascavel,fd2053290d5d7e56d41f33d9b7ad6f7572on2s2s.html",https://p2.trrsf.com/image/fget/cf/1200/630/middle/images.terra.com/2026/05/02/2026_05_09_luciano-santos-37-copia-(3)-sl3f8lz97141.JPG,,"A classificação da NASCAR Brasil para a etapa de Cascavel entregou emoção, estratégia e reviravoltas até os minutos finais. A sessão que definiu o grid de largada foi marcada pela instabilidade climá… [+3896 chars]",,2026-05-05 03:41:38+00:00,wmo,Brazil,SAM,South-America
eea02b62a045b0baaf9a7906c7e29dba,2026-05-01T00:00:07Z,Drought,seca timor leste,www.terra.com.br,pt,0.3,"Was ist eigentlich Staub? Die Wissenschaft hinter dem Staub, der niemals aus Innenräumen verschwindet. Was sich auf Möbeln verteilt, auf elektronischen Geräten wieder auftaucht und sich in scheinbar sauberen Ecken ansammelt, wird oft einfach als Staub bezeichnet.",O que realmente é a poeira? A ciência por trás do pó que nunca desaparece dos ambientes fechados,"O que se espalha pelos móveis, reaparece nos eletrônicos e se acumula em cantos aparentemente limpos costuma ser chamado apenas de poeira.","What really is dust? The science behind the dust that never disappears from indoor environments. What spreads across furniture, reappears on electronics, and accumulates in seemingly clean corners is often just called dust.","Quid est vere pulvis? Scientia post pulverem numquam ab ambitus tectis evanescit. Quae per supellectilem serpit, in electronicis redit, et in mundis quasi angulis accumulat, saepe solum pulvis dicitur.","https://www.terra.com.br/diversao/o-que-realmente-e-a-poeira-a-ciencia-por-tras-do-po-que-nunca-desaparece-dos-ambientes-fechados,f3c62dcc826365b4217a41f3a9f9df2b44tx2uwp.html",https://p2.trrsf.com/image/fget/cf/1200/630/middle/images.terra.com/2026/05/01/1174984364-poeira1777545438681.jpg,,"O que se espalha pelos móveis, reaparece nos eletrônicos e se acumula em cantos aparentemente limpos costuma ser chamado apenas de poeira. Porém, esse material fino e acinzentado que se acumula em am… [+7493 chars]",,2026-05-05 07:24:38+00:00,edo,Timor Leste,SEA,Oceania
38decd58a53e94a6882204215130a8ac,2026-05-01T01:00:29Z,Precipitation,chuva torrencial satun trang,catracalivre.com.br,pt,0.3,"Warum empfehlen Sie, eine Vase mit Lavendel ins Schlafzimmer zu stellen und wozu dient sie? Lavendel im Schlafzimmer hilft, den Schlaf zu verbessern und mehr Entspannung zu bringen. Erfahren Sie, wie Sie die Pflanze täglich nutzen und pflegen.
Der Beitrag Warum empfehlen Sie, eine Vase mit Lavendel ins Schlafzimmer zu stellen und wozu dient sie? erschien zuerst auf Catraca Livre.",Por que recomendam colocar um vaso de lavanda no quarto e para que ela serve?,"Lavanda no quarto ajuda a melhorar o sono e trazer mais relaxamento. Veja como usar a planta e cuidar dela no dia a dia.
O post Por que recomendam colocar um vaso de lavanda no quarto e para que ela serve? apareceu primeiro em Catraca Livre.","Why do you recommend putting a vase of lavender in the bedroom and what is it for? Lavender in the bedroom helps improve sleep and bring more relaxation. See how to use the plant and care for it on a daily basis.
The post Why do you recommend putting a vase of lavender in the bedroom and what is it for? appeared first on Catraca Livre.","Quid commendas vas casia in cubiculo ponere et quid est? Lavandula in cubiculo adiuvat somnum meliorem et relaxationem afferunt. Vide quomodo in cottidie utatur planta et cura.
cursorem Quid commendas vas casia in cubiculo posito et quid est? apparuit primo in Catraca Livre.",https://catracalivre.com.br/noticias/por-que-recomendam-colocar-um-vaso-de-lavanda-no-quarto-e-para-que-ela-serve/,https://i.catracalivre.com.br/_spTTMC4eaz_o-bp-6PSOl1gq9E=/1200x630/smart/filters:quality(60)/catracalivre.com.br/wp-content/uploads/2026/04/magnific-vaso-de-lavanda-com-flore-2893971949.jpg,,Colocar um vaso de lavanda no quarto deixou de ser só um detalhe bonito na decoração e virou quase um segredinho de cuidado com o sono e com o clima da casa. Essa plantinha de flores roxas e perfume … [+3664 chars],,2026-05-05 07:24:38+00:00,wmo,Thailand,SEA,Asia
05129c27c318fbe8b7db6022f905d66d,2026-05-01T11:44:34Z,Cold Wave,Brasil congelando,catracalivre.com.br,pt,0.3,"Damit der Rosmarin in Italien jahrelang gesund bleibt, besteht der Trick darin, ihn nicht zu gießen, sondern niemals in Töpfe zu pflanzen, deren Boden keine Steine ​​hat. Möchten Sie, dass Ihr Rosmarin jahrelang gesund bleibt? Der italienische Trick mit Steinen im Topf kann im Anbau alles verändern.
Der Beitrag Damit Rosmarin jahrelang gesund bleibt, besteht in Italien der Trick darin, nicht zu gießen, sondern niemals in Töpfe zu pflanzen, deren Boden keine Steine ​​hat, erschien erstmals in Kalifornien …","Na Itália, para o alecrim durar anos saudável, o macete não é a rega, mas nunca plantar em vasos que não tenham pedras no fundo","Quer seu alecrim saudável por anos? O truque italiano com pedras no vaso pode mudar tudo no cultivo.
O post Na Itália, para o alecrim durar anos saudável, o macete não é a rega, mas nunca plantar em vasos que não tenham pedras no fundo apareceu primeiro em Ca…","In Italy, for rosemary to last healthy for years, the trick is not watering, but never planting in pots that don't have stones at the bottom. Want your rosemary healthy for years? The Italian trick with stones in the pot can change everything in cultivation.
The post In Italy, for rosemary to last healthy for years, the trick is not watering, but never planting in pots that don't have stones at the bottom appeared first in Ca…","In Italia, pro roris marinis per annos durare sanus, dolus non rigat, sed numquam in ollas figit quae lapides in fundo non habent. Visne rore marino tuo sanus annis? Dolus Italicus cum lapidibus in olla omnia in cultura mutare potest.
Stipes In Italia, pro rorismarinis annis perdurare sanus, dolus non rigat, sed numquam in ollis figendis quae in fundo lapides non habent, primo apparuit in Ca…",https://catracalivre.com.br/noticias/na-italia-para-o-alecrim-durar-anos-saudavel-o-macete-nao-e-a-rega-mas-nunca-plantar-em-vasos-que-nao-tenham-pedras-no-fundo/,https://i.catracalivre.com.br/hj1Qdl0NrpH3GAXgO6Lkw2tCtmM=/1200x630/smart/filters:quality(60)/catracalivre.com.br/wp-content/uploads/2026/05/magnific-vaso-de-alecrim-saudavel-2902640750.jpg,,"Na Itália, onde o alecrim faz parte da tradição culinária e do cuidado com hortas caseiras, jardineiros experientes garantem que o segredo para essa erva durar anos não está na frequência da rega. O … [+4810 chars]",,2026-05-05 07:24:38+00:00,wmo,Brazil,SAM,South-America
f724361779401c957d7fc0c5c12c5bc2,2026-05-01T11:45:15Z,Fog,nevoeiro reino unido,catracalivre.com.br,pt,0.3,"Nur wenige wissen: Die effektivsten Möglichkeiten, Ameisenhaufen aus Ihrem Garten zu entfernen. Diese natürlichen Methoden gegen Ameisen sind auf dem Vormarsch, weil sie einfach und effektiv sind. Erfahren Sie, wie Sie es in Ihrem Garten anwenden.
Der Beitrag Nur wenige wissen es: Die effektivsten Möglichkeiten, Ameisenhaufen aus Ihrem Garten zu entfernen, erschien zuerst auf Catraca Livre.",Poucos sabem: as maneiras mais eficazes de eliminar formigueiros do seu jardim,"Esses métodos naturais contra formigas estão ganhando espaço por serem simples e eficazes. Entenda como aplicar no seu jardim.
O post Poucos sabem: as maneiras mais eficazes de eliminar formigueiros do seu jardim apareceu primeiro em Catraca Livre.","Few know: the most effective ways to eliminate anthills from your garden. These natural methods against ants are gaining ground because they are simple and effective. Understand how to apply it to your garden.
The post Few people know: the most effective ways to eliminate anthills from your garden appeared first on Catraca Livre.","Pauci sciunt: vias efficacissimas ex horto tuo anthills tollere. Hae methodi naturales contra formicas locum obtinent, quia simplices et efficaces sunt. Intellige quomodo ad hortum tuum applices.
Pauci homines sciunt: efficacissimas vias ad tollendas anthillas ex horto tuo primo in Catraca Livre apparuit.",https://catracalivre.com.br/noticias/poucos-sabem-as-maneiras-mais-eficazes-de-eliminar-formigueiros-do-seu-jardim/,https://i.catracalivre.com.br/hmjC9_3yqc3BWGk3fWRqm6AuO0M=/1200x630/smart/filters:quality(60)/catracalivre.com.br/wp-content/uploads/2026/05/magnific-formigueiro-visivel-no-gr-2901111797.jpg,,"Com a chegada dos dias mais quentes, as formigas começam a aparecer por todo lado no jardim, formando montinhos de terra no gramado e nos canteiros; no começo parece inofensivo, mas formigueiros gran… [+3850 chars]",,2026-05-05 07:24:38+00:00,wmo,United Kingdom,NEU,Europe
085c6883bda4841c07554edc24dd3c95,2026-05-01T12:33:13Z,Precipitation,chuva torrencial portugal,catracalivre.com.br,pt,0.3,"In japanischen Häusern gibt es keinen Staub, weil die Reinigung nicht nur einmal pro Woche, sondern täglich mit kleinen Ritualen erfolgt. Beim japanischen Putzen kommen einfache Gewohnheiten wie ein feuchtes Tuch und weniger Gegenstände zum Einsatz, um das Haus jeden Tag staubfrei zu halten.
Der Beitrag In japanischen Häusern gibt es keinen Staub, weil die Reinigung nicht nur einmal pro Woche, sondern täglich mit kleinen Ritualen erfolgt …","Nas casas japonesas não existe poeira porque a limpeza não é feita apenas uma vez por semana, mas sim diariamente, com pequenos rituais","A limpeza japonesa usa hábitos simples como pano úmido e menos objetos para manter a casa sem poeira todos os dias.
O post Nas casas japonesas não existe poeira porque a limpeza não é feita apenas uma vez por semana, mas sim diariamente, com pequenos rituais …","In Japanese homes there is no dust because cleaning is not done just once a week, but daily, with small rituals. Japanese cleaning uses simple habits like a damp cloth and fewer objects to keep the house dust-free every day.
The post There is no dust in Japanese homes because cleaning is not done just once a week, but daily, with small rituals…","In Iaponicis domibus pulvis non est quia purgatio non semel in hebdomada, sed cotidie cum parvis ritibus fit. Iaponica purgatio simplicibus habitibus utitur sicut panno humido et paucioribus obiecta ad custodiam domus pulveris quotidie liberam.
Postes pulvis in Iaponica domiciliis non est quia purgatio non semel in hebdomada, sed cotidie cum parvis ritibus... fit.",https://catracalivre.com.br/noticias/nas-casas-japonesas-nao-existe-poeira-porque-a-limpeza-nao-e-feita-apenas-uma-vez-por-semana-mas-sim-diariamente-com-pequenos-rituais/,https://i.catracalivre.com.br/fNtqzX-1Z62ks7xWiVDwP0ayTV0=/1200x630/smart/filters:quality(60)/catracalivre.com.br/wp-content/uploads/2026/05/magnific-sala-minimalista-com-supe-2901465409.jpg,,A imagem das casas japonesas impecavelmente limpas não se explica por horas de faxina intensa nos fins de semana. Explica-se por uma lógica completamente diferente de relação com a limpeza japonesa: … [+8328 chars],,2026-05-05 07:24:38+00:00,wmo,Portugal,MED,Europe
c9ba88a13a41cd319bf1529b297de212,2026-05-01T17:06:04Z,Cold Wave,temperaturas geladas no sul da Austrália,catracalivre.com.br,pt,0.3,"Damit die Orchidee jahrelang hält, gilt in Thailand: Der Trick besteht darin, nicht zu düngen, aber niemals den Kern der Blätter zu benetzen. Erfahren Sie, wie Sie tropische Blumen pflegen, indem Sie Wurzelfäule vermeiden und für Wurzelbelüftung sorgen. Wichtige Tipps, um Ihre Epiphyten gesund zu halten.
Der Beitrag Damit die Orchidee in Thailand jahrelang hält: Der Trick besteht darin, nicht zu düngen, aber den Kern niemals zu benetzen …","Na Tailândia, para a orquídea durar anos: o macete não é o adubo, mas nunca molhar o miolo das folhas","Aprenda a cuidar de flores tropicais evitando o apodrecimento do colo e garantindo a ventilação das raízes. Dicas essenciais para manter suas epífitas saudáveis.
O post Na Tailândia, para a orquídea durar anos: o macete não é o adubo, mas nunca molhar o miolo…","In Thailand, for the orchid to last for years: the trick is not fertilizer, but never wet the core of the leaves. Learn how to care for tropical flowers by avoiding root rot and ensuring root ventilation. Essential tips to keep your epiphytes healthy.
The post In Thailand, for the orchid to last for years: the trick is not fertilizer, but never wet the core…","In Thailandia, ORCHIS pro annis durare: dolum stercorat non est, sed nucleum foliorum numquam madefacit. Disce quomodo florum tropicorum curare cavendo radicis putrescat et prospiciendo radicis evacuatione. Apices essentiales ut epiphyta tua sana custodiant.
Stipes In Thailandia, orchis per annos durare: dolus non stercorat, sed nucleum numquam madefacit…",https://catracalivre.com.br/noticias/na-tailandia-para-a-orquidea-durar-anos-o-macete-nao-e-o-adubo-mas-nunca-molhar-o-miolo-das-folhas-2/,https://i.catracalivre.com.br/DsE54q4WtdQGgOP1nyj-diSjt8g=/1200x630/smart/filters:quality(60)/catracalivre.com.br/wp-content/uploads/2026/05/magnific-flor-tropical-em-vaso-com-2901281059.jpg,,Manter flores tropicais vibrantes e saudáveis exige uma compreensão profunda sobre a relação entre a água e a estrutura das plantas. O grande segredo para a longevidade das espécies mais sensíveis nã… [+3978 chars],,2026-05-05 07:24:38+00:00,acwe,Australia,SAU,Oceania
4ab48e078c83ff920879fa3e32c1265e,2026-05-01T17:40:43Z,Tropical Cyclone,ciclone tropical dinamarca,ultimosegundo.ig.com.br,pt,0.3,"Spudnik: Entdecken Sie die von NASA-Astronauten angebaute Kartoffel. Ein seltsames improvisiertes Experiment auf der Internationalen Raumstation enthüllte, wie Wurzeln außerhalb der Schwerkraft unseres Planeten reagieren",Spudnik: conheça a batata cultivada por astronautas da NASA,Um curioso experimento improvisado na Estação Espacial Internacional revelou como raízes reagem fora da gravidade do nosso planeta,Spudnik: discover the potato grown by NASA astronauts. A curious improvised experiment on the International Space Station revealed how roots react outside of our planet's gravity,Spudnik: annuum annuum ab astronautis NASA crevit. Curiosum experimentum tumultuatum in Statione Spatii Internationalis ostendit quomodo radices agere extra gravitatis nostrae planetae,https://ultimosegundo.ig.com.br/ciencia/2026-05-01/spudnik--conheca-a-batata-espacial-cultivada-por-astronautas-da-nasa.html,https://i0.statig.com.br/bancodeimagens/9a/tg/ql/9atgqlgx6weswn803b1xfn5lv.jpg,,"O astronauta da NASA, Don Pettit chamou atenção nas redes sociais ao apresentar seu mais novo experimento a bordo da Estação Espacial Internacional: uma batata roxa apelidada de Spudnik. O cultivo im… [+2363 chars]",,2026-05-05 07:24:38+00:00,wmo,Denmark,NEU,Europe
