index,published,topic,term,domain,language,valid,de,title,description,en,la,url,image,archive,content,quote,added,feed,country,ipcc,continent
177d5bee67859afb9bda4e288417e8ce,2026-05-08T23:02:48Z,Thunderstorm,tempo severo Canadá,observador.pt,pt,0.3,"Drei Grade und die Versuchung des Friedens. Was macht Portugal mit der Nachricht, dass das Schlimmste unwahrscheinlich und schlimm genug wahrscheinlich ist?",Três graus e a tentação do sossego,O que faz Portugal com a notícia de que o pior é improvável e o suficientemente mau é provável?,Three degrees and the temptation of peace. What does Portugal do with the news that the worst is unlikely and bad enough is likely?,Tres gradus et pacis tentatio. Quid facit Portugallia cum nuntio pessimum veri simile et malum satis probabile est?,https://observador.pt/opiniao/tres-graus-e-a-tentacao-do-sossego-a-ciencia-climatica-diante-do-espelho-da-sua-maturidade/,https://wm.observador.pt/wm-op/wide-circle/https%3A%2F%2Fbordalo.observador.pt%2Fv2%2Frs%3Afill%3A900%2Fc%3A1281%3A1281%3Anowe%3A114%3A0%2Fq%3A70%2Ff%3Awebp%2Fplain%2Fhttps%3A%2F%2Fs3.observador.pt%2Fwp-content%2Fuploads%2F2022%2F06%2F17222511%2Fantero-carvalho-foto.jpg,,"O Painel Intergovernamental para as Alterações Climáticas abandonou os cenários mais sombrios e fixou o pior caso plausível em 3 a 3,5 graus de aquecimento até 2100. Em vez de descanso, esta revisão … [+7177 chars]",,2026-05-14 07:50:38+00:00,wmo,Canada,NEN,North-America
acff28adbe858d9983830312177b4681,2026-05-11T20:23:43Z,Precipitation,aguaceiro portugal,g1.globo.com,pt,0.3,"Gebratenes Kaninchen, herzhafte Churros, gebratener Thai-Reis: Erfahren Sie alles über das Festa das Nações in Piracicaba. -Das Piracicaba Festival of Nations findet vom 13. bis 17. Mai statt
Rathaus von Piracicaba
Das 41. Piracicaba-Festival der Nationen beginnt an diesem Mittwoch (13) und dauert bis Sonntag (17) im Engenho Central. Mit herzhaften Churros, gebratenem Thai-Reis, Kaninchen …","Coelho frito, churros salgado, arroz frito tailandês: veja tudo sobre a Festa das Nações de Piracicaba","-Festa das Nações de Piracicaba acontece entre os dias 13 e 17 de maio
Prefeitura de Piracicaba
A 41ª Festa das Nações de Piracicaba começa nesta quarta-feira (13) e segue até domingo (17), no Engenho Central. Com churros salgado, arroz frito tailandês, coelh…","Fried rabbit, savory churros, Thai fried rice: see everything about Piracicaba's Festa das Nações. -Piracicaba Festival of Nations takes place between the 13th and 17th of May
Piracicaba City Hall
The 41st Piracicaba Festival of Nations begins this Wednesday (13) and continues until Sunday (17), at Engenho Central. With savory churros, Thai fried rice, rabbit…","Lepus frictus, saturosus churro, Thai frixum oryza: omnia vide de Festa das Nações de Piracicaba. -Piracicaba Festivitas Nationum fit inter 13 et diem 17 mensis Maii
Piracicaba City Hall
Piracicaba Festivitas Nationum hoc die Mercurii incipit (13) et pergit usque ad Dominicam (17), Engenho Centrali. Churros sapida, Thai frixum oryza, lepus…",https://g1.globo.com/sp/piracicaba-regiao/noticia/2026/05/11/coelho-frito-churros-salgado-arroz-frito-tailandes-veja-tudo-sobre-a-festa-das-nacoes-de-piracicaba.ghtml,https://s2-g1.glbimg.com/HzvhA_a77WKIIkCyyFddYwRPz8Y=/2000x0/filters:format(jpeg)/https://i.s3.glbimg.com/v1/AUTH_59edd422c0c84a879bd37670ae4f538a/internal_photos/bs/2023/S/r/oBPmH9SpitCGQdBSUQGQ/serao-cinco-dias-da-festa-que-une-gastronomia-cultura-e-solidariedade.jpg,,"O público poderá provar pratos típicos de 19 países: África do Sul, Alemanha, Argentina, Áustria, Brasil, Coreia, Espanha, Estados Unidos, França, Holanda, Itália, Japão, México, Moçambique, Nações Á… [+47 chars]",,2026-05-14 07:50:38+00:00,wmo,Portugal,MED,Europe
8b6e49bf9882c74bb87bafc20f333d4b,2026-05-11T23:04:32Z,Tropical Cyclone,ciclone,observador.pt,pt,0.7,Mosambik hat die höchste Zahl an Vertriebenen in Afrika. Die Wirbelstürme Dikeledi und Jude verursachten in einer einzigen Saison 826.000 Bewegungen im Land. Der IDMC-Bericht weist außerdem auf 339.000 Vertreibungen aufgrund des Konflikts in Cabo Delgado hin.,Moçambique com maior número de deslocados em África,Ciclones Dikeledi e Jude provocaram 826 mil movimentos no país numa única época. Relatório do IDMC aponta ainda 339 mil deslocações devido ao conflito em Cabo Delgado.,Mozambique with the highest number of displaced people in Africa. Cyclones Dikeledi and Jude caused 826 thousand movements in the country in a single season. IDMC report also points to 339 thousand displacements due to the conflict in Cabo Delgado.,Mozambique cum supremis Africae populis luxatis. Cyclones Dikeledi et Iudas 826 mille motus in regione uno tempore effecit. Renuntiatio IDMC etiam demonstrat 339 milia obsessorum ob conflictum in Cabo Delgado.,https://observador.pt/2026/05/12/mocambique-com-maior-numero-de-deslocados-em-africa-devido-a-catastrofes-em-2025/,https://wm.observador.pt/wm/l/https%3A%2F%2Fbordalo.observador.pt%2Fv2%2Frs%3Afill%3A770%3A403%2Fc%3A2000%3A1124%3Anowe%3A0%3A104%2Fq%3A70%2Ff%3Awebp%2Fplain%2Fhttps%3A%2F%2Fs3.observador.pt%2Fwp-content%2Fuploads%2F2026%2F02%2F10134550%2F46493479.jpg?layer=obstop:T,,"Moçambique foi a nação da África Subsaariana que registou o maior número de deslocações devido a catástrofes, segundo o “Relatório Global sobre Deslocações Internas 2026” publicado esta segunda-feira… [+2712 chars]",,2026-05-14 07:50:38+00:00,random,,,
7553a31c250306ba0f3b60765a0dbe5e,2026-05-01T20:00:09Z,Thunderstorm,tempo severo guarda,veja.abril.com.br,pt,0.3,"Wettervorhersage für Samstag, 2.: Kaltfront verändert das Szenario im Süden und an der Küste von São Paulo. In der Stadt São Paulo wird die Höchsttemperatur 29 °C betragen","Previsão do tempo no sábado, 2: frente fria muda o cenário no Sul e no litoral paulista",Cidade de São Paulo terá máxima de 29ºC,"Weather forecast for Saturday, 2nd: cold front changes the scenario in the South and on the coast of São Paulo. City of São Paulo will have a maximum temperature of 29ºC","Tempestas praenuntius Saturni, 2nd: frigus ante missionem in meridiem et in ora São Pauli mutat. Urbs São Pauli maximam temperiem 29ºC . habebit",https://veja.abril.com.br/agenda-verde/previsao-do-tempo-no-sabado-2-frente-fria-muda-o-cenario-no-sul-e-no-litoral-paulista/,"https://veja.abril.com.br/wp-content/uploads/2025/02/anhangabau_chuva_11_0.jpg?quality=70&strip=info&resize=1080,565&crop=1",,"Pular para o conteúdo
Receba 4 Revistas em casa por 35,90/mêsVale do Anhangabaú, no centro de São Paulo (Paulo Pinto/Agência Brasil)
Continua após publicidade
<ul><li>Sábado de contrastes climátic… [+3829 chars]",,2026-05-14 11:59:59+00:00,wmo,Portugal,MED,Europe
5342fd84f9df0b99712f973218592f95,2026-05-05T15:39:22Z,Heat Wave,inverno ameno no oeste da Austrália,www.terra.com.br,pt,0.3,Von 31°C auf 11°C: Porto Alegre steht diese Woche vor einer thermischen „Achterbahnfahrt“. Vorbereitung ist unerlässlich: Die Woche beginnt mit großer Hitze und endet mit der Notwendigkeit dicker Mäntel in der Hauptstadt.,"De 31°C a 11°C: Porto Alegre enfrenta ""montanha-russa"" térmica nesta semana",Preparação é essencial: semana começa com calor intenso e termina com necessidade de casacos pesados na capital.,From 31°C to 11°C: Porto Alegre faces a thermal “rollercoaster” this week. Preparation is essential: the week starts with intense heat and ends with the need for heavy coats in the capital.,"Ab 31°C ad 11°C: Porto Alegre thermas ""rollercoaster"" hac septimana respicit. Praeparatio essentialis est: hebdomade incipit cum ardore maximo et desinit cum necessariis tunicis in capite.","https://www.terra.com.br/noticias/de-31c-a-11c-porto-alegre-enfrenta-montanha-russa-termica-nesta-semana,498f89058269e3f7d155b47aceb499c7ogmk1gob.html",https://p2.trrsf.com/image/fget/cf/1200/630/middle/images.terra.com/2026/05/05/1154093211-captura-de-tela-2023-08-28-as-135839.jpg,,"Os porto-alegrenses devem se preparar para mudanças drásticas no guarda-roupa nos próximos dias. Nesta quarta-feira, o clima abafado predomina, com os termômetros alcançando os 31°C à tarde. Embora o… [+1149 chars]",,2026-05-14 11:59:59+00:00,acwe,Australia,CAU,Oceania
f033bf3d52cad7550d03afaa79283abe,2026-05-06T19:58:43Z,Precipitation,aguaceiro coimbra,veja.abril.com.br,pt,0.3,"Warnung vor Stürmen in RS an diesem Donnerstag, den 7.: Finden Sie die Climatempo-Prognose nach Region heraus. In der Stadt São Paulo wird die Temperatur maximal 29°C betragen","Alerta para temporais no RS nesta quinta, 7: saiba a previsão do Climatempo por região",Cidade de São Paulo terá máxima de 29°C,"Alert for storms in RS this Thursday, 7th: find out the Climatempo forecast by region. City of São Paulo will have a maximum of 29°C","Pro procellis erecti in RS hoc Iovis, VII: explora Climtempo regionem ominari. Urbs Sancti Pauli maximam partem 29°C . habebit",https://veja.abril.com.br/agenda-verde/alerta-para-temporais-no-rs-nesta-quinta-7-saiba-a-previsao-do-climatempo-por-regiao/,"https://veja.abril.com.br/wp-content/uploads/2024/03/mg_0563.webp?resize=1080,565&crop=1",,"Pular para o conteúdo
Receba 4 Revistas em casa por 35,90/mês (Fernando Frazão/Agência Brasil)
Continua após publicidade
<ul><li>A quinta-feira, 7, será marcada pela chegada de uma frente fria no … [+4808 chars]",,2026-05-14 11:59:59+00:00,wmo,Portugal,MED,Europe
31b2250ecf5fdc517bd052c2633d2103,2026-05-02T20:00:27Z,Precipitation,chuva forte,veja.abril.com.br,pt,0.8,"Wetteränderungen in São Paulo an diesem Sonntag, den 3.: Finden Sie heraus, was Climatempo sagt. An der Küste von São Paulo wird vor starkem Regen, starkem Wind und Kater gewarnt","Virada de tempo em São Paulo neste domingo, 3: saiba o que diz o Climatempo","Litoral paulista tem alerta para chuva volumosa, ventos fortes e ressaca","Weather changes in São Paulo this Sunday, 3rd: find out what Climatempo says. São Paulo coast has warning for heavy rain, strong winds and hangover","Tempestatis mutationes in São Paulo hac die Dominico III: experire quid dicat Climtempo. Litus São Paulo monet de pluviis, ventis validis et hangover",https://veja.abril.com.br/agenda-verde/virada-de-tempo-em-sao-paulo-neste-domingo-3-saiba-o-que-diz-o-climatempo/,"https://veja.abril.com.br/wp-content/uploads/2023/11/Chuva_3290991747.jpg?quality=70&strip=info&resize=1080,565&crop=1",,"Pular para o conteúdo
Receba 4 Revistas em casa por 35,90/mês (Gabriel Fernandes/Wikimedia Commons)
Continua após publicidade
<ul><li>O domingo, 3 de março, marca uma virada climática no Brasil. U… [+4154 chars]",,2026-05-14 11:59:59+00:00,random,,,
c56671f4abd43afd4db6a599959335c2,2026-05-05T18:42:48Z,Precipitation,chuva forte,observador.pt,pt,0.8,"Aufgrund des schlechten Wetters ist der Flughafen Madeira konditioniert. Sechs Flugzeuge gingen auseinander und sechs ankommende Flugzeuge wurden bereits annulliert. Flüge werden auf Mittwoch verschoben, da die orangefarbene Warnung bis 18 Uhr gilt und Regen und starker Wind vorhergesagt sind.",Aeroporto da Madeira condicionado devido ao mau tempo,"Seis aviões divergidos e seis chegadas já foram canceladas. Voos estão a ser adiados até quarta-feira, por causa do aviso laranja que se mantém até às 18h00, com previsão de chuva e vento forte.","Madeira Airport conditioned due to bad weather. Six planes diverged and six arrivals have already been cancelled. Flights are being postponed until Wednesday, due to the orange warning that remains in place until 6pm, with rain and strong winds forecast.","Madeira Airport condiciones ex tempestatibus. Sex aeroplana abscessit et sex iam ablatis advenis. Volatus in diem Mercurii differuntur, ob monitionem orange quod in loco usque ad 6pm manet, cum pluvia et ventis validis praesagio.",https://observador.pt/2026/05/05/movimento-no-aeroporto-da-madeira-condicionado-devido-ao-mau-tempo/,https://wm.observador.pt/wm/l/https%3A%2F%2Fbordalo.observador.pt%2Fv2%2Frs%3Afill%3A770%3A403%2Fc%3A2000%3A1126%3Anowe%3A0%3A113%2Fq%3A70%2Ff%3Awebp%2Fplain%2Fhttps%3A%2F%2Fs3.observador.pt%2Fwp-content%2Fuploads%2F2018%2F03%2F03185007%2F18389044.jpg?layer=obstop:T,,"O mau tempo está esta terça-feira a condicionar o regular movimento de aterragens e descolagens no Aeroporto Internacional da Madeira  Cristiano Ronaldo, havendo seis aviões divergidos e seis chegada… [+807 chars]",,2026-05-14 11:59:59+00:00,random,,,
9794ce8c50489c382a65ef775b72ccca,2026-05-01T16:30:33Z,Thunderstorm,granizo,www.terra.com.br,pt,0.9,Eine Sturm- und Hagelwarnung geht einem plötzlichen Temperaturabfall in Porto Alegre voraus. Auf einen Samstag mit extremer Instabilität folgt ein Sonntag mit extremer Kälte in der Hauptstadt von Rio Grande do Sul mit einem Minimum von 4 °C.,Alerta de temporal e granizo precede queda brusca de temperatura em Porto Alegre,"Sábado de instabilidade extrema será seguido por um domingo de frio intenso na capital gaúcha, com mínima de 4°C.","Storm and hail warning precedes a sudden drop in temperature in Porto Alegre. A Saturday of extreme instability will be followed by a Sunday of intense cold in the capital of Rio Grande do Sul, with a minimum of 4°C.",Tempestas et grando admonitio subitam guttam caliditatis in Porto Alegre praecedit. Sabbatum extremae instabilitatis sequetur dominica dies frigoris in capite Rio Grande do Sul cum minimum 4°C.,"https://www.terra.com.br/noticias/alerta-de-temporal-e-granizo-precede-queda-brusca-de-temperatura-em-porto-alegre,72a774de26cb06190498f7dbdba39e4dihupnpb1.html",https://p2.trrsf.com/image/fget/cf/1200/630/middle/images.terra.com/2026/05/01/1321365719-captura-de-tela-2025-08-03-as-104344.jpg,,"A capital gaúcha inicia o final de semana sob alerta meteorológico. No sábado, 2 de maio, a previsão aponta para um cenário de forte instabilidade, com muitas nuvens, pancadas de chuva e risco de que… [+1170 chars]",,2026-05-14 11:59:59+00:00,random,,,
9679609b44936c2aaafba82d50859563,2026-05-07T16:47:38Z,Cold Wave,onda fria,olhardigital.com.br,pt,0.9,"Kaltfront lässt die Temperaturen in Teilen Brasiliens sinken. Die erste Kältewelle des Jahres beginnt an diesem Freitag (8) und könnte die Temperaturen im Süden und Südosten Brasiliens um bis zu 5 °C senken
Der Beitrag „Kaltfront lässt Temperaturen in Teilen Brasiliens sinken“ erschien zuerst auf Olhar Digital.",Frente fria derruba temperaturas em parte do Brasil,"Primeira onda de frio do ano começa nesta sexta (8) e pode derrubar temperaturas em até 5 °C no Sul e Sudeste do Brasil
O post Frente fria derruba temperaturas em parte do Brasil apareceu primeiro em Olhar Digital.","Cold front drops temperatures in part of Brazil. The first cold wave of the year begins this Friday (8) and could drop temperatures by up to 5 °C in the South and Southeast of Brazil
The post Cold front drops temperatures in part of Brazil appeared first on Olhar Digital.","In parte Brasiliae guttae frigidae ante temperaturas. Prima unda frigida anni huius Veneris incipit (8) et temperaturas stillare potuit usque ad 5°C in Brasilia Australi et Southeast.
Post Frigidum ante guttas temperaturas in parte Brasiliae primum in Olhar Digital apparuit.",https://olhardigital.com.br/2026/05/07/ciencia-e-espaco/frente-fria-derruba-temperaturas-em-parte-do-brasil/,https://olhardigital.com.br/wp-content/uploads/2026/05/frente-fria.jpg,,"A primeira onda de frio de 2026 começa a atingir o Brasil a partir desta sexta-feira (8), com previsão de derrubar as temperaturas em parte do Sul, Sudeste e Centro-Oeste até a próxima quarta-feira (… [+3696 chars]",,2026-05-14 11:59:59+00:00,random,,,
ab8144e29289e50433d217fb331ee16a,2026-05-09T20:00:03Z,Cold Wave,onda de frio,veja.abril.com.br,pt,0.9,"Regen und Kälte prägen den Muttertag in São Paulo: siehe Prognose von Climatempo. Die erste Kältewelle des Jahres 2026 erreicht diesen Sonntag, den 10., die Hauptstadt von São Paulo",Chuva e frio marcam o Dia das Mães em São Paulo: veja a previsão do Climatempo,"Primeira onda de frio de 2026 chega à capital paulista neste domingo, 10","Rain and cold mark Mother's Day in São Paulo: see Climatempo's forecast. First cold wave of 2026 arrives in the capital of São Paulo this Sunday, 10","Imber et frigus signum Matris Dies matris in São Paulo: vide praesagium Climtemponis. Primum unda frigida 2026 in caput São Pauli hac Dominica, 10 . pervenit",https://veja.abril.com.br/agenda-verde/chuva-e-frio-marcam-o-dia-das-maes-em-sao-paulo-veja-a-previsao-do-climatempo/,"https://veja.abril.com.br/wp-content/uploads/2019/09/frio-em-sao-paulo.jpg?quality=70&strip=info&resize=1080,565&crop=1",,"Pular para o conteúdo
Receba 4 Revistas em casa por 32,90/mês (Reprodução/Reprodução)
Continua após publicidade
<ul><li>São Paulo terá Dia das Mães (10 de maio) com frio e chuva persistente, com t… [+4076 chars]",,2026-05-14 11:59:59+00:00,random,,,
b5c59ea15d6fcb369adb6e917e689047,2026-05-12T11:33:24Z,Heat Wave,calor recorde,www.terra.com.br,pt,0.8,"Die Brände haben ein Rekordniveau erreicht und es drohen „beispiellose“ Hitzeextreme, sagen Wissenschaftler. Der Klimawandel hat in diesem Jahr Rekordbrände in Afrika, Asien und anderswo ausgelöst ...","Incêndios atingem recorde e extremos de calor ""sem precedentes"" se aproximam, dizem cientistas","A mudança climática provocou incêndios recordes ‌na África, na Ásia e em outros lugares este ...","Fires are at record levels and ""unprecedented"" heat extremes loom, scientists say. Climate change has sparked record fires ‌in Africa, Asia and elsewhere this...","Ignes in gradus recordationis sunt et ""inauditum"" calor extrema pecten, phisici dicunt. Clima mutatio incendia commovit recordum ‌in Africa, Asia et alibi hoc.","https://www.terra.com.br/noticias/mundo/incendios-atingem-recorde-e-extremos-de-calor-sem-precedentes-se-aproximam-dizem-cientistas,b666f969f56c17c8c1c34e56a890ed5f96a87hrw.html",https://s1.trrsf.com/update-1698692222/fe/zaz-mod-t360-icons/svg/logos/terra-16x9-borda.png,,"A mudança climática provocou incêndios recordes ‌na África, na Ásia e em outros lugares este ano, com a expectativa de que as condições piorem com a aproximação do verão no hemisfério norte e o iníci… [+2880 chars]",,2026-05-16 11:09:29+00:00,random,,,
be000124ef0969398654d544eb6d8f3e,2026-05-12T07:23:45Z,Precipitation,chuva guarda,observador.pt,pt,0.7,"Für die Bezirke Bragança und Guarda gilt gelbe Warnung wegen Regen. Bragança und Guarda stehen unter Gelbwarnung. Die IPMA prognostiziert Perioden mit stark bewölktem Himmel und Schauern, die eher im Norden und in der Mitte zu beobachten sind und deren Intensität ab Dienstagnachmittag abnimmt.",Distritos de Bragança e Guarda sob aviso amarelo com chuva,"Bragança e Guarda estão sob aviso amarelo. O IPMA prevê períodos de céu muito nublado e aguaceiros, mais prováveis no Norte e Centro, diminuindo de intensidade a partir da tarde desta terça-feira.","Districts of Bragança and Guarda under yellow warning with rain. Bragança and Guarda are under yellow warning. The IPMA predicts periods of very cloudy skies and showers, more likely in the North and Center, decreasing in intensity from Tuesday afternoon onwards.","Pagi Bragança et Guarda sub flavo monitu cum pluvia. Bragança et Guarda sub flavo monitu. Tempora IPMA caelorum et imbrium nubilum praedicit, magis in septentrione et centro verisimilius, intensio decrescentes a die Martis post meridiem.",https://observador.pt/2026/05/12/distritos-de-braganca-e-guarda-sob-aviso-amarelo-com-chuva/,https://wm.observador.pt/wm/l/https%3A%2F%2Fbordalo.observador.pt%2Fv2%2Frs%3Afill%3A770%3A403%2Fc%3A1440%3A809%3Anowe%3A0%3A75%2Fq%3A70%2Ff%3Awebp%2Fplain%2Fhttps%3A%2F%2Fs3.observador.pt%2Fwp-content%2Fuploads%2F2025%2F05%2F15093309%2Ftempo.jpg?layer=obstop:T,http://web.archive.org/web/20260512080241/https://observador.pt/2026/05/12/distritos-de-braganca-e-guarda-sob-aviso-amarelo-com-chuva/,"Os distritos de Bragança e Guarda estão sob aviso amarelo face à previsão de aguaceiros por vezes fortes e acompanhados de trovoada, anunciou esta terça-feira o Instituto Português do Mar e da Atmosf… [+744 chars]",,2026-05-16 21:00:56+00:00,wmo,Portugal,MED,Europe
5e1eaed6a2cd848ea2c5daafe431740b,2026-05-07T03:54:32Z,Heat Wave,onda de calor na Tasmânia,www.terra.com.br,pt,0.1,"Mit einem Punkt weniger kommt Cruzeiro in Chile für die Libertadores unentschieden. Raposa ließ Arroyo zu Beginn der zweiten Halbzeit vom Platz stellen und hielt in einem verkürzten Spiel, bei Regen in Santiago und mit wenigen Chancen, beim 0:0","Com um a menos, Cruzeiro arranca empate no Chile pela Libertadores","Raposa tem Arroyo expulso no início do segundo tempo e segura o 0 a 0 de um jogo truncado, sob chuva em Santiago e com poucas oportunidades","With one less, Cruzeiro draws in Chile for the Libertadores. Raposa had Arroyo sent off at the beginning of the second half and held on to 0-0 in a truncated game, under rain in Santiago and with few opportunities","Uno minus, Cruzeiro in Chile pro Libertadores trahit. Raposa Arroyo dimissa erat in principio mediae secundae et tenuerat in ludo 0-0 in truncato, sub pluvia in Santiago et cum paucis occasionibus.","https://www.terra.com.br/esportes/cruzeiro/com-um-a-menos-cruzeiro-arranca-empate-no-chile-pela-libertadores,55acf27d12a2e845527180cbf8248e68mcnzyvqu.html",https://p2.trrsf.com/image/fget/cf/1200/630/middle/images.terra.com/2026/05/07/1504180625-552530914073288bc57e5oeasy-resizecom-610x400.jpg,,"Cruzeiro e Universidad Católica ficaram no empate em 0 a 0 nesta quarta-feira, 6/5, no Estádio San Carlos de Apoquindo, em Santiago, no Chile. O jogo valeu pela 4ª rodada do Grupo D da Libertadores, … [+3307 chars]",,2026-05-17 04:13:12+00:00,acwe,Australia,SAU,Oceania
7dd8565ceb7d90255998b17f68a3943e,2026-05-04T22:26:40Z,Drought,período de seca na Letónia,www.revistabula.com,pt,0.3,"Die Generation brasilianischer Schriftsteller, die im Mittelpunkt der Literatur stand. Ein Buchhandlungstisch, einer von denen in der Nähe des Eingangs, verändert jede Woche sein Gesicht. Manchmal sagt er, ohne es zu wollen, was in den Berichten steht. Ein Buchhandlungstisch, wie er in der Nähe des Eingangs steht, verändert jede Woche sein Gesicht. Manchmal heißt es, ohne es zu wollen, was die Berichte",A geração de escritoras brasileiras que tomou o centro da literatura,"Uma mesa de livraria, daquelas perto da entrada, muda de rosto toda semana. Às vezes diz, sem querer, o que os relatóriosUma mesa de livraria, daquelas perto da entrada, muda de rosto toda semana. Às vezes diz, sem querer, o que os relatórios","The generation of Brazilian writers who took the center of literature. A bookstore table, one of those near the entrance, changes its face every week. Sometimes he says, without meaning to, what the reports say. A bookstore table, the kind near the entrance, changes its face every week. Sometimes it says, without meaning to, what the reports","Generatio scriptorum Brasiliensium qui centrum litterarum suscepit. Tabula libraria, una ex propinquis ad introitum, mutat faciem omni septimana. Aliquando dicit, sine sensu, id quod fama dicunt. Tabula libraria, genus prope introitum, faciem mutat singulis hebdomadibus. Aliquando dicit otiose, quod auditum est",https://www.revistabula.com/159796-a-geracao-de-escritoras-brasileiras-que-tomou-o-centro-da-literatura/,https://www.revistabula.com/wp/wp-content/uploads/2026/05/capa-1.webp,,"Uma mesa de livraria, daquelas perto da entrada, muda de rosto toda semana. Às vezes diz, sem querer, o que os relatórios só confirmam depois. Não a mesa dos clássicos, com os mortos em capa nova, ne… [+19445 chars]",,2026-05-17 04:13:12+00:00,edo,Latvia,WCE,Europe
cad0b7ab57151ade5ae3d7e4adcc626e,2026-05-12T10:17:05Z,Precipitation,chuva forte,expresso.pt,pt,0.9,Auf dem portugiesischen Festland gilt aufgrund starker Regenfälle und Gewitter die gelbe Warnung. Das portugiesische Institut für Meer und Atmosphäre hat für diesen Dienstag eine gelbe Warnung für das gesamte Land herausgegeben. Für die zentralen und nördlichen Bezirke gilt eine verlängerte Warnung bis 18 Uhr,Portugal continental sob aviso amarelo devido a chuva forte e trovoada,Instituto Português do Mar e da Atmosfera emitiu aviso amarelo para esta terça-feira para todo o país. Distritos do Centro e do Norte com aviso prolongado até às 18h,Mainland Portugal under yellow warning due to heavy rain and thunderstorms. Portuguese Institute of the Sea and Atmosphere issued a yellow warning for this Tuesday for the entire country. Central and Northern Districts with extended warning until 6pm,In continenti Portugalliae monitu flavo ob pluvias et tonitrua. Institutum Lusitanum Maris et Atmosphaerae fulvum monitionem hanc Martis pro tota terra denuntiavit. Centralis et Septentrionalium Pagi cum extensa monitione usque ad 6pm,https://expresso.pt/meteorologia/2026-05-12-portugal-continental-sob-aviso-amarelo-devido-a-chuva-forte-e-trovoada-8a439ae2,https://images.impresa.pt/expresso/2026-04-05-chuva-chapeu-mulher-0b9a2373/1.91x1?wm=true&outputFormat=jpeg,,"Todos os distritos de Portugal continental estão esta terça-feira sob aviso amarelo devido à previsão de chuva, por vezes forte e acompanhada de trovoada, segundo o Instituto Português do Mar e da At… [+863 chars]",,2026-05-17 16:04:48+00:00,random,,,
