index,published,topic,term,domain,language,valid,de,title,description,en,la,url,image,archive,content,quote,added,feed,country,ipcc,continent
b2f68713b7b3c6cdeaf06cbf39e00a65,2026-03-03T01:06:55Z,Landslide,deslizamento de terra na Noruega,www.diariodocentrodomundo.com.br,pt,0.3,"Europas Unterwerfung unter die Torheiten eines verrückten Kaisers. Von Miguel do Rosário. Indem sie den amerikanischen Angriff auf den Iran unterstützen, offenbaren die europäischen Staats- und Regierungschefs einen tiefgreifenden Mangel an Wissen über den Charakter des iranischen Volkes und die historische Tradition, die sein Verhalten bestimmt, wenn die nationale Souveränität bedroht ist. Feigheit, Zynismus, Vasallentum und Doppelzüngigkeit …",A submissão da Europa às loucuras de um imperador louco. Por Miguel do Rosário,"Ao apoiarem o ataque americano ao Irã, as lideranças europeias revelam um profundo desconhecimento do caráter do povo iraniano e da tradição histórica que orienta sua conduta quando a soberania nacional é ameaçada. A covardia, o cinismo, a vassalagem e o dupl…","Europe's submission to the follies of a mad emperor. By Miguel do Rosário. By supporting the American attack on Iran, European leaders reveal a profound lack of knowledge of the character of the Iranian people and the historical tradition that guides their conduct when national sovereignty is threatened. Cowardice, cynicism, vassalage and duplicity…","Insanientis imperatoris ineptiis Europa obsequitur. Per Michaelem do Rosário. Sustentando Americanorum oppugnationem in Irania, duces Europaei profundam ignorantiam detegunt indolem populi Iraniani et traditionem historicam, quae eorum mores ducit cum regimen nationale imminet. Pusillanimitas, protervitas, vassalitas ac duplicitas…",https://www.diariodocentrodomundo.com.br/a-submissao-da-europa-as-loucuras-de-um-imperador-louco-por-miguel-do-rosario/,https://www.diariodocentrodomundo.com.br/wp-content/uploads/2026/03/donald-trump-1.jpg,,"Donald Trump, presidente dos EUA – Reprodução
Ao apoiarem o ataque americano ao Irã, as lideranças europeias revelam um profundo desconhecimento do caráter do povo iraniano e da tradição histórica q… [+12032 chars]",,2026-03-11 15:58:38+00:00,wmo,Norway,NEU,Europe
304a0d7b0cfa2106913f3f35c9105aa2,2026-03-03T12:00:24Z,Snow&Ice,neve bragança,theconversation.com,pt,0.3,"Die Ankunft des Regens in der Antarktis sollte das Gesicht des gefrorenen Kontinents verändern. Regen schmilzt Schnee und entzieht den Gletschern ihre Eisquelle. Darüber hinaus bilden sich Pfützen, die die Eisschelfs destabilisieren",Chegada da chuva na Antártica deve mudar a face do continente gelado,"Chuva derrete a neve e tira dos glaciares sua fonte de gelo, além de formar poças que desestabilizam plataformas de gelo","The arrival of rain in Antarctica should change the face of the frozen continent. Rain melts snow and strips glaciers of their source of ice, in addition to forming puddles that destabilize ice shelves","Adventus pluviae in Antarctica faciem continentis gelidae mutare debet. Imber nix liquescit et stringit molibus glaciei suae fontem, praeter palu formatam quae crustas glaciem destabilit.",https://theconversation.com/a-chuva-esta-chegando-na-antartica-e-vai-mudar-a-face-do-continente-gelado-277060,https://images.metroimg.com/2025/07/11184421/Antartica-2.jpg,,"*O artigo foi escrito por Bethan Davies, professora da Universidade de Newcastle, e publicado na plataforma The Conversation Brasil.A chuva é rara na Antártica. Cientistas que trabalham em campo na r… [+7352 chars]",,2026-03-11 15:58:38+00:00,wmo,Portugal,MED,Europe
80e0bb540736c5fd040da6b61fc7446d,2026-03-06T16:39:24Z,Snow&Ice,Canadá gelado,esporte.ig.com.br,pt,0.3,"Wer ist der Brasilianer, der in einer Riesenwelle in Nazaré das Leben gerettet hat? Surfer Gabriel Sampaio schilderte iG, wie er seinen Kollegen Alessandro Marciano in einem der gefährlichsten Meere der Welt rettete",Quem é o brasileiro que salvou vida em onda gigante de Nazaré,O surfista Gabriel Sampaio detalhou ao iG como resgatou o colega Alessandro Marciano em um dos mares mais perigosos do mundo,Who is the Brazilian who saved life in a giant wave in Nazaré? Surfer Gabriel Sampaio detailed to iG how he rescued his colleague Alessandro Marciano in one of the most dangerous seas in the world,"Quis est Brasiliensis, qui in unda gigante in Nazareo vitam servavit? Surfer Gabriel Sampaio explicavit ad iG quomodo collegam suum Alessandro Marciano in uno mari periculosissimo in mundo eripuit",https://esporte.ig.com.br/maisesportes/surfe/2026-03-06/quem-e-o-brasileiro-que-salvou-vida-em-onda-gigante-de-nazare.html,https://i0.statig.com.br/bancodeimagens/eb/gs/ze/ebgsze4ukc9uagczjd46tf3qi.jpg,,O brasileiro GabrielSampaio viveu uma temporada emocionante em 2025. O surfista de 29 anos é atleta do big surf (categoria dedicada à prática em ondas gigantes). Além de concorrer à premiação de Maio… [+5296 chars],,2026-03-11 15:58:38+00:00,wmo,Canada,NEN,North-America
96e0bff5ad252a2911908747ea4842ec,2026-03-01T21:00:59Z,Iceberg,iceberg antártica,super.abril.com.br,pt,0.7,"Regen kommt in die Antarktis und wird das Gesicht des gefrorenen Kontinents verändern. Regen schmilzt Schnee und entzieht den Gletschern ihre Eisquelle, wodurch Eisberge häufiger kalben – und das Überleben der Pinguine gefährdet wird",A chuva está chegando na Antártica e vai mudar a face do continente gelado,"Chuva derrete a neve e tira dos glaciares sua fonte de gelo, aumentando o desprendimento de icebergs – e ameaçando a sobrevivência de pinguins","Rain is coming to Antarctica and will change the face of the frozen continent. Rain melts snow and strips glaciers of their source of ice, increasing the calving of icebergs – and threatening the survival of penguins","Imber ad Antarcticam venit et faciem continentis gelidi mutabit. Imber nix dissolvit et denudat molibus glaciei fontem suae, foetus icebergs augens - et imminens salvos penguins",https://super.abril.com.br/ciencia/a-chuva-esta-chegando-na-antartica-e-vai-mudar-a-face-do-continente-gelado/,"https://super.abril.com.br/wp-content/uploads/2011/04/pinguim.jpg?quality=70&strip=info&resize=1080,565&crop=1",,"Bethan Davies é professora de glaciologia na Universidade Newcastle. O texto abaixo foi publicado originalmente no site The Conversation 
A chuva é rara na Antártica. Cientistas que trabalham em cam… [+7899 chars]",,2026-03-11 15:58:38+00:00,random,,,
748560553c44c450bdad4c5900612ed6,2026-03-09T11:36:39Z,Heat Wave,dia mais quente,catracalivre.com.br,pt,0.8,"Ich habe zu spät verstanden, warum man Pflanzen niemals in der Mittagssonne gießen sollte. Erfahren Sie, welche Risiken das Gießen von Pflanzen bei starker Sonneneinstrahlung mit sich bringt, und lernen Sie effiziente Techniken kennen, um Ihren Garten auch an den heißesten Tagen mit Feuchtigkeit zu versorgen und gesund zu halten.
Der Beitrag „Ich habe zu spät verstanden, warum man Pflanzen niemals in der Mittagssonne gießen sollte“ erschien zuerst…",Eu entendi tarde demais por que nunca se deve regar as plantas no sol do meio-dia,"Aprenda os riscos de regar plantas sob o sol intenso e veja técnicas eficientes para manter o seu jardim hidratado e saudável durante os dias mais quentes.
O post Eu entendi tarde demais por que nunca se deve regar as plantas no sol do meio-dia apareceu prime…","I understood too late why you should never water plants in the midday sun. Learn the risks of watering plants in intense sunlight and see efficient techniques to keep your garden hydrated and healthy during the hottest days.
The post I understood too late why you should never water plants in the midday sun appeared first…","Sero intellexi cur numquam in sole meridiano plantas rigare deberes. Disce pericula plantarum in intenso sole inrigandi et efficaces artes videas ut hortum tuum hydratum et sanum in calidissimis diebus custodiat.
Sero postes intellexi cur numquam ante meridiem solis aqua in plantis primum apparuit…",https://catracalivre.com.br/noticias/eu-entendi-tarde-demais-por-que-nunca-se-deve-regar-as-plantas-no-sol-do-meio-dia/,https://i.catracalivre.com.br/6cKQKyFAsiT19ThOimO2BUjGWXQ=/1200x630/smart/filters:quality(60)/catracalivre.com.br/wp-content/uploads/2026/03/creation-2532997852.png,,"Manter um jardim saudável exige muita atenção aos detalhes, especialmente quando lidamos com os desafios de manter a hidratação das plantas nos dias mais abafados. Muitos iniciantes acreditam que mol… [+4294 chars]",,2026-03-12 05:59:57+00:00,random,,,
5f50f77a406773c40171aa584b883919,2026-03-03T16:38:24Z,Drought,umidade do solo,catracalivre.com.br,pt,0.9,"Gärtner empfehlen, einen Zahnstocher in die Erde im Topf zu stecken, um in Sekundenschnelle den Feuchtigkeitsgehalt der Erde zu erkennen und zu erkennen, ob die Pflanze aufgrund von zu viel Wasser oder mangelnder Bewässerung welk wird: Wie geht das? Das Einstechen eines Zahnstochers in die Erde hilft dabei, überschüssiges Wasser oder mangelnde Bewässerung zu erkennen und schützt die Wurzeln vor Fäulnis.
Der Beitrag Gärtner empfehlen, einen Zahnstocher in die Erde im Topf zu stecken, um den Feuchtigkeitsgehalt der Erde in Sekundenschnelle zu erkennen und zu unterscheiden, ob...",Jardineiros recomendam enfiar um palito de dente na terra do vaso para detectar o nível de umidade do solo em segundos e distinguir se a planta está murchando por excesso de água ou por falta de rega: Como fazer?,"Enfiar um palito na terra ajuda a identificar excesso de água ou falta de rega e protege as raízes do apodrecimento.
O post Jardineiros recomendam enfiar um palito de dente na terra do vaso para detectar o nível de umidade do solo em segundos e distinguir se …","Gardeners recommend sticking a toothpick into the soil in the pot to detect the soil's moisture level in seconds and distinguish whether the plant is wilting due to too much water or lack of watering: How to do it?. Sticking a toothpick into the soil helps identify excess water or lack of watering and protects the roots from rot.
The post Gardeners recommend sticking a toothpick into the soil in the pot to detect the soil's moisture level in seconds and distinguish whether...","Hortulani commendant dentifricium in solo haerentem in olla ad deprehendendum solo humore in secundo gradu et distingue, an planta ex nimia aqua exusta sit vel inriguo: Quid facere?. DENTISCALPIUM adhaerens in solo adiuvat ad cognoscendum excessum aquae vel defectus rigandi et radices a putredine tuetur.
Hortulani cursores commendant dentifricium in solo haerentem in olla ut in secundo gradu humoris soli deprehendas et distinguas num...",https://catracalivre.com.br/noticias/jardineiros-recomendam-enfiar-um-palito-de-dente-na-terra-do-vaso-para-detectar-o-nivel-de-umidade-do-solo-em-segundos-e-distinguir-se-a-planta-esta-murchando-por-excesso-de-agua-ou-por-falta-de-rega/,https://i.catracalivre.com.br/SMa5IlJMFSgbY98ZSTJwgs3p18A=/1200x630/smart/filters:quality(60)/catracalivre.com.br/wp-content/uploads/2026/03/freepik-close-em-mo-retirando-um-palito-de-dente-da-terra-7227.png,,"Regar demais mata a planta tão rápido quanto não regá-la, e esse é o erro mais comum entre quem cultiva plantas em vasos em casa. Para resolver essa dúvida de forma imediata, sem equipamentos e sem c… [+6385 chars]",,2026-03-12 05:59:57+00:00,random,,,
f3469bcec53cf28cb97761329affbaa0,2026-03-10T09:26:31Z,Heat Wave,inverno ameno em Nova Gales do Sul,catracalivre.com.br,pt,0.3,"Das Lieblingsobst auf Familienfesten, das früher für Obstschalen sorgte, wächst nun mit nostalgischem Flair auf dem Balkon. Erfahren Sie, wie Sie Feigenbäume in Balkontöpfen züchten, um süße Früchte zu ernten, ohne Insekten anzulocken. Ein umfassender Leitfaden für Gebäudebewohner und Süßigkeitenliebhaber.
Der Beitrag Das Lieblingsobst auf Familienfesten, das früher Obstschalen bescherte, wächst jetzt auf dem Balkon mit…",A fruta favorito das festas de família que dava bacias de frutos agora é cultivado na varanda com um ar nostálgico,"Aprenda a cultivar figueiras em vasos de varanda para colher frutos doces sem atrair insetos. Um guia completo para moradores de prédios e amantes de doces.
O post A fruta favorito das festas de família que dava bacias de frutos agora é cultivado na varanda c…","The favorite fruit at family parties that used to provide bowls of fruit is now grown on the balcony with a nostalgic air. Learn how to grow fig trees in balcony pots to harvest sweet fruits without attracting insects. A complete guide for building residents and sweet lovers.
The post The favorite fruit at family parties that used to give bowls of fruit is now grown on the balcony with…","Fructus gratissimus in partibus familiaribus, qui phialas fructus praebere solebant, nunc in maeniano cum aere nostalgico crevit. Disce quomodo ficus arbores in podio poculis crescunt, ut fructus dulces sine insectis alliciant. Dux integer edificandi incolas et dulces amantes.
Postes fructus gratissimus in partibus familiaribus quae phialas fructus dare solebant nunc in maeniano cum ... crevit.",https://catracalivre.com.br/noticias/a-fruta-favorito-das-festas-de-familia-que-dava-bacias-de-frutos-agora-e-cultivado-na-varanda-com-um-ar-nostalgico/,https://i.catracalivre.com.br/odxYEK9i9dq3JkO5EYxAjaNukvI=/1200x630/smart/filters:quality(60)/catracalivre.com.br/wp-content/uploads/2026/03/creation-2541400903.png,,Trazer o sabor da infância para dentro de um apartamento moderno é uma jornada gratificante que une o design contemporâneo ao prazer da colheita manual. O cultivo da figueira em vasos se tornou uma t… [+4931 chars],,2026-03-12 10:53:18+00:00,acwe,Australia,EAU,Oceania
d97f4cf39a729cba855d19b9f5b6b715,2026-03-06T09:00:00Z,Insect Infestation,gafanhoto,abertoatedemadrugada.com,pt,0.3,Produkte der Woche. Hama Zubehör für Galaxy S26; HUAWEI Mate X7 kommt in Portugal an; Hisense bringt intelligenten Kühlschrank auf den Markt; Der LEGO Store in Coimbra wird am 14. März eröffnet,Produtos da Semana,Acessórios Hama para Galaxy S26; HUAWEI Mate X7 chega a Portugal; Hisense lança frigorífico inteligente; Loja LEGO em Coimbra abre a 14 de março,Products of the Week. Hama Accessories for Galaxy S26; HUAWEI Mate X7 arrives in Portugal; Hisense launches smart refrigerator; LEGO store in Coimbra opens on March 14th,Producta hebdomadis. Hama Accessories for Galaxy S26; HUAWEI Mate X7 in Lusitaniam venit; Hisense sollicitudin arcu leo; Lego copia in Coimbra opens die 14 Martii,https://abertoatedemadrugada.com/2026/03/produtos-da-semana.html,https://blogger.googleusercontent.com/img/b/R29vZ2xl/AVvXsEh_v9afRZ3B3pgwaV_-oQdcitfhfX0_muc6c8aO1EzBU_Zcv6v93GRL4Tzz_MNUm1YZc19uQ41iOITzdxFplaQyj5pNIDiXz8Jmkqke_AUqVEcNuSh4DNGQvt-LK2-n8prZg9JPo5q8zzHw4qZBpoCIgxfeH-XOhxfpQieS2DxdYMslxyynb4Qiolibc4JM/w1200-h630-p-k-no-nu/hama.jpg,,"A nossa rubrica de Produtos da Semana agrupa uma lista de produtos e notícias que vamos compilando ao longo da semana e que achamos que será do interesse geral.



Acessórios Hama para Galaxy S26



… [+8435 chars]",,2026-03-13 05:58:06+00:00,random,,,
9c3c68db9dc05543c41bf34609f2f5ba,2026-03-09T17:31:41Z,Precipitation,chuva brasil,ultimosegundo.ig.com.br,pt,0.7,"Sehen Sie sich die Regionen Brasiliens mit dem meisten Regen in dieser Woche an. Meteorologische Vorhersagen deuten auf hohe Ansammlungen vor allem im Norden und Südosten hin, mit der Möglichkeit intensiver Mengen in einigen Bundesstaaten",Veja as regiões do Brasil com mais chuva nesta semana,"Previsão meteorológica indica acumulados elevados principalmente no Norte e no Sudeste, com possibilidade de volumes intensos em alguns estados","See the regions of Brazil with the most rain this week. Meteorological forecast indicates high accumulations mainly in the North and Southeast, with the possibility of intense volumes in some states","Vide in Brasilia regiones hac septimana pluvia maxima. Praedictio meteorologica altas accumulationes indicat maxime in Septentrionali et Meridiano, cum possibilitas intensissima voluminum in quibusdam civitatibus",https://ultimosegundo.ig.com.br/brasil/2026-03-09/veja-as-regioes-do-brasil-com-mais-chuva-nesta-semana.html,https://i0.statig.com.br/bancodeimagens/e2/5q/1g/e25q1g80g5gxblbcr2qxr5jtq.jpg,,"As regiões Norte e Sudeste do Brasil devem registrar os maiores volumes de chuva nesta semana, de acordo com previsão divulgada pela MetSul Meteorologia. O levantamento aponta que os acumulados mais … [+1767 chars]",,2026-03-13 15:54:17+00:00,wmo,Brazil,SAM,South-America
3baa1cef72246d21c00c97f149a3d337,2026-03-02T07:00:00Z,Precipitation,chuva guarda,expresso.pt,pt,0.8,"Rui Cardoso: „Irans Vergeltung zeigt dem Nahen Osten, dass der Schutzschirm der Vereinigten Staaten existiert, aber er lässt zu wünschen übrig.“ Wie groß ist die wahre Reaktionsfähigkeit des iranischen Regimes? Paulo Baldaia spricht in diesem Expresso da Manhã mit Rui Cardoso","Rui Cardoso: “A retaliação do Irão mostra ao Médio Oriente que o guarda-chuva dos Estados Unidos existe, mas deixa muito a desejar”",Qual é a verdadeira capacidade de resposta do regime iraniano? Paulo Baldaia conversa com Rui Cardoso neste Expresso da Manhã,"Rui Cardoso: “Iran’s retaliation shows the Middle East that the United States’ umbrella exists, but it leaves a lot to be desired.” What is the Iranian regime's true response capacity? Paulo Baldaia talks to Rui Cardoso in this Expresso da Manhã","Rui Cardoso: ""Iran retaliatio in Medio Oriente ostendit umbellam Americae Foederatae Americae esse, sed multum optandum relinquit"". Quid est verum responsum regiminis Iraniani capacitatis? Paulus Baldaia cum Rui Cardoso in hoc Expresso da Manhã loquitur",https://expresso.pt/podcasts/expresso-da-manha/2026-03-02-rui-cardoso-a-retaliacao-do-irao-mostra-ao-medio-oriente-que-o-guarda-chuva-dos-estados-unidos-existe-mas-deixa-muito-a-desejar-cde5b965,https://images.impresa.pt/sicnot/2025-09-03-expresso-da-manha-2025-paulo-baldaia---3x2.jpg-304f137a/1.91x1?wm=true&outputFormat=jpeg,,"A capacidade de retaliação do regime iraniano, mais do que fazer mossa nos atacantes, põe em causa a imagem das petromonarquias, como a Arábia Saudita, o Dubai ou os Emirados que se apresentam ao mun… [+479 chars]",,2026-03-13 20:49:00+00:00,wmo,Portugal,MED,Europe
c53dd00ea296e63521f38dc0d3df4adf,2026-03-09T10:41:29Z,Precipitation,chuva brasil,www.metropoles.com,pt,0.7,Die Kaltfront rückt vor und setzt für fast ganz Brasilien eine Regenwarnung; siehe Prognose. Laut Inmet sind alle Regionen des Landes wegen starken Regens gewarnt. An einigen Standorten kann es zu Unannehmlichkeiten kommen,Frente fria avança e coloca quase todo o Brasil sob alerta de chuva; veja previsão,"De acordo com o Inmet, todas as regiões do país estão sob alertas paras chuvas intensas. Algumas localidades podem ter transtornos","Cold front advances and puts almost all of Brazil under rain warning; see forecast. According to Inmet, all regions of the country are under alerts for intense rain. Some locations may experience inconvenience","Frons frigida progreditur et fere tota Brasilia sub pluvia admonetur; see auguror. Secundum Inmet, omnes regiones regionis sub summis imbres sunt. Quibusdam locis sentiamus incommodo",https://www.metropoles.com/brasil/frente-fria-avanca-e-deixa-quase-todo-o-brasil-sob-alerta-de-chuva,https://i.metroimg.com/VgrWcr98ofZG9YR3H6aLr2rkNY_zK8puOAB9wPkQkb4/w:1200/q:90/f:webp/plain/https://images.metroimg.com/2026/03/chuvas-parana.jpg,,"A chegada de uma frente fria deve provocar chuva forte em quase todo o país nesta segunda-feira (9/3). O Instituto Nacional de Meteorologia (Inmet), emitiu alertas de “perigo potencial” para chuvas i… [+3508 chars]",,2026-03-14 05:55:18+00:00,wmo,Brazil,SAM,South-America
8a0051be10af160a321c460c2e39c0e8,2026-03-10T11:39:31Z,Fog,nevoeiro Canadá,www.terra.com.br,pt,0.3,"Die Krise am Golf lässt die Treibstoffpreise steigen und setzt die Länder unter Druck, zu reagieren. Während die Angriffe im Iran und in anderen Golfstaaten nicht aufhören, spürt die Welt bereits die Folgen einer neuen Energiekrise, die durch den Rückgang der Ölproduktion und -exporte verursacht wird. In mehreren Ländern ist Kraftstoff an der Zapfsäule bereits teurer,…",Crise no Golfo dispara preço dos combustíveis e pressiona países a reagir,"Enquanto os ataques não cessam no Irã e em outros países do Golfo, o mundo já sente as consequências de uma nova crise energética provocada pela diminuição da produção e exportação de petróleo. Os combustíveis já estão mais caros na bomba em diversos países, …","Crisis in the Gulf raises fuel prices and pressures countries to react. While the attacks do not cease in Iran and other Gulf countries, the world is already feeling the consequences of a new energy crisis caused by the decline in oil production and exports. Fuel is already more expensive at the pump in several countries,…","Crisis in Sinu cibus pretia suscitat et pressuras nationum agere potest. Dum impetus in Irania et in aliis regionibus sinus non cessant, mundus iam sentiens eventus novae crisi industriae causatur per declinationem in productione olei et exportationis. Cibus iam carior est apud sentinam in pluribus regionibus,…","https://www.terra.com.br/noticias/mundo/europa/crise-no-golfo-dispara-preco-dos-combustiveis-e-pressiona-paises-a-reagir,8009e534a1829a74180c8ddc3e4a8f2bhgxe4829.html",https://s1.trrsf.com/update-1698692222/fe/zaz-mod-t360-icons/svg/logos/terra-16x9-borda.png,,"O fechamento do Estreito de Ormuz, por onde circulam 20% da oferta mundial de petróleo e gás, além da ofensiva iraniana contra diversos países produtores, fez os estoques diminuírem e os preços dispa… [+2426 chars]",,2026-03-14 15:37:09+00:00,wmo,Canada,NEN,North-America
17f1c9d68b5982717401a0791608dbf2,2026-03-11T08:00:00Z,Precipitation,precipitação nova zelândia,www.infomoney.com.br,pt,0.3,"Überlastetes Unternehmen, ungünstiges Klima und Meinungsverschiedenheiten zwischen den Partnern: Verstehen Sie Raízens Krise. Die Möglichkeit, eine außergerichtliche Beitreibung zu beantragen, wird derzeit geprüft; Eine mutige Strategie und Hebelwirkung in einer Zeit hoher Zinsen untergruben die finanzielle Gesundheit des Unternehmens
Der Beitrag Verschuldetes Unternehmen, ungünstiges Klima und Meinungsverschiedenheiten zwischen den Partnern: Verstehen Sie Raízens Krise …","Empresa alavancada, clima adverso e desencontro de sócios: entenda a crise da Raízen","Possibilidade de pedido de recuperação extrajudicial está em estudo; estratégia ousada e alavancagem em período de juros altos minaram saúde financeira da companhia
The post Empresa alavancada, clima adverso e desencontro de sócios: entenda a crise da Raízen …","Leveraged company, adverse climate and disagreement between partners: understand Raízen's crisis. The possibility of requesting extrajudicial recovery is being studied; Bold strategy and leverage in a period of high interest rates undermined the company's financial health
The post Leveraged company, adverse climate and partner disagreement: understand Raízen’s crisis …","Turba levetur, caelum adversa et dissensio inter socios: discrimen Raízen intellege. Facultas petendi extraiudicialem recuperationem perscrutatur; Audax consilium et leverage in periodo magni interest rates labefactarunt societatis financial salutem
Societas post Leveraged, clima adversa et particeps dissensio: intellege discrimen Raízen …",https://www.infomoney.com.br/business/empresa-alavancada-clima-adverso-e-desencontro-de-socios-entenda-a-crise-da-raizen/,https://www.infomoney.com.br/wp-content/uploads/2026/03/E2G_Raizen.webp?fit=860%2C420&quality=70&strip=all,,"A admissão oficial da Raízen (RAIZ4) de que a solução para sua crise financeira pode passar, se necessário, por um pedido de recuperação extrajudicial, explicitada em fato relevante no dia 4, é o ápi… [+8839 chars]",,2026-03-14 20:39:35+00:00,wmo,New Zealand,NZ,Oceania
31877a7f3a1189c249efdce09fd9aa44,2026-03-11T09:12:08Z,Thunderstorm,granizo,ultimosegundo.ig.com.br,pt,0.9,"Inmet warnt für diesen Mittwoch (11) vor Niederschlagsmengen von bis zu 100 mm/Tag. Es besteht die Möglichkeit von Überschwemmungen, Sturzfluten und Erdrutschen. Es werden außerdem heftige Schauer, starker Wind und Hagel erwartet.",Inmet alerta para chuvas de até 100mm/dia nesta quarta-feira (11),"Há possibilidade de alagamentos, enxurradas e deslizamentos. São esperadas também pancadas fortes, ventos intensos e queda de granizo","Inmet warns of rainfall of up to 100mm/day this Wednesday (11). There is a possibility of flooding, flash floods and landslides. Heavy showers, intense winds and hail are also expected.","Inmet monet pluvias usque ad 100mm/diei huius Mercurii (11). Est possibilitas inundationis, diluvii et proruit. Imbres graves, venti vehementes et grandines etiam exspectantur.",https://ultimosegundo.ig.com.br/brasil/2026-03-11/inmet-alerta-para-chuvas-de-ate-100mm-dia-nesta-quarta-feira-11.html,https://i0.statig.com.br/bancodeimagens/29/hn/uv/29hnuv4vvpjubdfgeqhkgcniw.jpg,,"O Instituto Nacional de Meteorologia (Inmet) emitiu alerta de chuvas intensas, como também risco de tempestade, para diversas regiões do Brasil nesta quarta-feira (11). Segundo o Inmet, são esperadas… [+2997 chars]",,2026-03-15 10:41:20+00:00,random,,,
