index,published,topic,term,domain,language,valid,de,title,description,en,la,url,image,archive,content,quote,added,feed,country,ipcc,continent
931c293d1dba4a28ef7a607fda6f35bf,2026-05-01T20:16:59Z,Storm,tempestade litoral e serra,catracalivre.com.br,pt,0.3,"Nur wenige wissen: Die effektivsten Möglichkeiten, Unkraut in Ihrem Garten zu beseitigen, ohne Gift zu verwenden. Die Beseitigung von Unkraut ohne Gift ist in vielen Gärten zu einer Priorität geworden. Entdecken Sie natürliche Methoden, die dazu beitragen, den Raum sauber und gesund zu halten.
Der Beitrag Wenige wissen: Die effektivsten Möglichkeiten, Unkraut in Ihrem Garten zu beseitigen, ohne Gift zu verwenden, erschienen p…",Poucos sabem: as maneiras mais eficazes de eliminar as ervas daninhas do seu jardim sem usar veneno,"Eliminar plantas daninhas sem veneno virou prioridade em muitos jardins. Veja métodos naturais que ajudam a manter o espaço limpo e saudável.
O post Poucos sabem: as maneiras mais eficazes de eliminar as ervas daninhas do seu jardim sem usar veneno apareceu p…","Few know: the most effective ways to eliminate weeds in your garden without using poison. Eliminating weeds without poison has become a priority in many gardens. See natural methods that help keep the space clean and healthy.
The post Few know: the most effective ways to eliminate weeds in your garden without using poison appeared p…","Pauci sciunt: efficacissimas zizania in horto tuo tolli sine veneno utens. Herbas sine veneno resecuit in multis hortis prioritas facta est. Vide modos naturales qui adiuvant ut spatium mundum et sanam conservet.
Post Pauci noverunt: efficacissimas vias ad zizania tollendas in horto tuo sine veneno utens apparuit p…",https://catracalivre.com.br/noticias/poucos-sabem-as-maneiras-mais-eficazes-de-eliminar-as-ervas-daninhas-do-seu-jardim-sem-usar-veneno/,https://i.catracalivre.com.br/JA1o-YcCByuzXMaFurhJu_gcbeI=/1200x630/smart/filters:quality(60)/catracalivre.com.br/wp-content/uploads/2026/05/magnific-canteiro-de-jardim-com-me-2901119738.jpg,,"Cuidar de um jardim é quase como cuidar de uma casa cheia de vida: todo dia tem algum detalhe pra olhar de perto. Entre esses detalhes, lidar com as plantas daninhas é um trabalho chato, mas necessár… [+3558 chars]",,2026-05-05 07:24:38+00:00,wmo,Ecuador,NWS,South-America
c90ce2f5ccf0b44a43959ff960eda1b9,2026-05-01T20:26:02Z,Precipitation,chuva Tailândia,catracalivre.com.br,pt,0.3,"Der alte amerikanische Baum eignet sich ideal zum Parfümieren des Gartens und wächst noch immer in einem Topf. Erfahren Sie, wie Sie Magnolia grandiflora in Töpfen anbauen, um Eleganz und Duft in Ihr Zuhause zu bringen. Sehen Sie sich Tipps zur Entwässerung und zum organischen Substrat für Ihre Pflanze an.
Der Beitrag Der alte amerikanische Baum, der sich ideal zum Parfümieren des Gartens eignet und noch immer in einem Topf wächst, erschien zuerst …","A árvore americana milenar ideal para perfumar o jardim, e ainda cresce em vaso","Aprenda a cultivar a Magnolia grandiflora em vasos para trazer sofisticação e perfume ao seu lar. Veja dicas de drenagem e substrato orgânico para sua planta.
O post A árvore americana milenar ideal para perfumar o jardim, e ainda cresce em vaso apareceu prim…","The ancient American tree is ideal for perfuming the garden, and it still grows in a pot. Learn how to grow Magnolia grandiflora in pots to bring sophistication and perfume to your home. See drainage and organic substrate tips for your plant.
The post The ancient American tree, ideal for perfuming the garden, and still growing in a pot appeared first…","Antiqua arbor Americana est specimen paradisi odorandi, et adhuc crescit in olla. Magnolia grandiflora crescere disce in ollis ruditatis et unguentum ad domum tuam adducere. Vide INCILE et organicum substratum apicibus pro planta tua.
Arbor antiqua Americana, specimen paradisi odorandi, et adhuc crescens in olla apparuit primum…",https://catracalivre.com.br/noticias/a-arvore-americana-milenar-ideal-para-perfumar-o-jardim-e-ainda-cresce-em-vaso/,https://i.catracalivre.com.br/ty0Agg3heSe3VTq4YznDeCJvDPY=/1200x630/smart/filters:quality(60)/catracalivre.com.br/wp-content/uploads/2026/05/magnific-magnolia-grandiflora-em-v-2901278138.jpg,,A presença de uma Magnolia grandiflora em ambientes residenciais compactos traz uma aura de elegância que poucos elementos conseguem proporcionar aos moradores mais exigentes. Com suas folhas verdes … [+4335 chars],,2026-05-05 07:24:38+00:00,wmo,Thailand,SEA,Asia
e169929c2469c174380e53291eeb0a19,2026-05-02T08:14:49Z,Storm,tempestade chile,catracalivre.com.br,pt,0.3,"So schaffen Sie eine Pflanzenbarriere gegen Skorpione und Tausendfüßler. Aromatische Pflanzen wie Citronella und Lavendel helfen, Skorpione zu reduzieren, indem sie Insekten abwehren und den Garten ungünstiger machen.
Der Beitrag Wie man eine Pflanzenbarriere gegen Skorpione und Tausendfüßler schafft, erschien zuerst auf Catraca Livre.",Como criar uma barreira vegetal contra escorpiões e centopeias,"Plantas aromáticas como citronela e lavanda ajudam a reduzir escorpiões ao afastar insetos e tornar o quintal menos favorável.
O post Como criar uma barreira vegetal contra escorpiões e centopeias apareceu primeiro em Catraca Livre.","How to create a plant barrier against scorpions and centipedes. Aromatic plants like citronella and lavender help reduce scorpions by warding off insects and making the yard less favorable.
The post How to create a plant barrier against scorpions and centipedes appeared first on Catraca Livre.","Plantam facere obice contra scorpiones et centipedes. Plantae aromaticae sicut citronellae et casia adiuvant scorpiones minuere, insecta propulsando et navale minus idonea.
Postes Quomodo plantam munimentum contra scorpiones et centipedes creare primum apparuit in Catraca Livre.",https://catracalivre.com.br/noticias/como-criar-uma-barreira-vegetal-contra-escorpioes-e-centopeias/,https://i.catracalivre.com.br/IydjyfWLyeQ4M6P2EbIvHlomP4I=/1200x630/smart/filters:quality(60)/catracalivre.com.br/wp-content/uploads/2026/05/magnific-quintal-residencial-brasi-2901556410.jpg,,"A presença de escorpiões e centopeias em quintais e áreas residenciais está quase sempre ligada a três fatores: abrigo disponível, umidade e comida farta na forma de insetos. Criar uma barreira veget… [+8640 chars]",,2026-05-05 07:24:38+00:00,wmo,Chile,SWS,South-America
4bdea531593840859b33f14210dce8f6,2026-05-02T11:45:34Z,Thunderstorm,granizo oran,catracalivre.com.br,pt,0.3,"Schützen Sie Ihre Pflanzen mit Kaffeesatz: der ultimative und äußerst wirksame Trick, um Insekten aus Ihrem Garten fernzuhalten. Die Verwendung von Kaffeesatz im Garten liegt im Trend, da er auf natürliche Weise Schädlinge abwehrt. Verstehen Sie, wie Sie es anwenden und Ihre Pflanzen gesund halten.
Der Beitrag Schützen Sie Ihre Pflanzen mit Kaffeesatz: der ultimative und äußerst wirksame Trick, um Insekten von Ihrem Garten fernzuhalten …",Proteja suas plantas com as borras de café: o truque definitivo e super eficaz para manter os insetos longe do seu jardim,"Usar borra de café no jardim virou tendência por afastar pragas naturalmente. Entenda como aplicar e manter suas plantas saudáveis.
O post Proteja suas plantas com as borras de café: o truque definitivo e super eficaz para manter os insetos longe do seu jardi…","Protect your plants with coffee grounds: the definitive and super effective trick to keep insects out of your garden. Using coffee grounds in the garden has become a trend as it naturally wards off pests. Understand how to apply and keep your plants healthy.
The post Protect your plants with coffee grounds: the definitive and super effective trick to keep insects away from your garden…","Protege plantas tuas cum argumentis capulus: dolum definitivum et supervacaneum ad servandum insecta ex horto tuo. Usura capulus rationes in horto inclinatio facta est ut pestes naturaliter arcet. Intellige quomodo plantas tuas adhibere et sanam custodire.
Stipes plantas tuas cum argumentis capulus protege: dolum definitivum et supervacaneum ad servandum insecta ab horto tuo…",https://catracalivre.com.br/noticias/adeus-a-musculacao-e-aos-alongamentos-este-e-o-exercicio-ideal-para-quem-tem-mais-de-70-anos/,https://i.catracalivre.com.br/UcbRBP7so_lo27I5JFf6ZxZ_HG0=/1200x630/smart/filters:quality(60)/catracalivre.com.br/wp-content/uploads/2026/05/magnific-borras-de-cafe-espalhadas-2900837615.jpg,,"Café passado pronto, aquele cheirinho bom na cozinha e a borra? Em vez de jogar fora, dá pra transformar esse restinho em aliado do jardim, ajudando a afastar insetos chatos, aproveitando melhor o qu… [+3790 chars]",,2026-05-05 07:24:38+00:00,wmo,Algeria,SAH,Africa
5b31dfdc82b755c14ac35f54b7a3e6d3,2026-05-03T09:12:36Z,Landslide,deslizamento de rochas,catracalivre.com.br,pt,0.3,"Diese 5 Pflanzen lieben Bananenschalen: Sie wachsen schneller, werden stärker und schöner. Bananenschalen als natürlicher Dünger helfen beim Pflanzenwachstum, der Blüte und den Wurzeln. Verstehen Sie, wie Sie es verwenden können, ohne Ihrer Kultivierung zu schaden.
Der Beitrag Diese 5 Pflanzen lieben Bananenschalen: Sie wachsen schneller, werden stärker und schöner erschien zuerst in C…","Estas 5 plantas adoram casca de banana: crescem mais rápido, ficam mais fortes e mais bonitas","A casca de banana como adubo natural ajuda no crescimento, floração e raízes das plantas. Entenda como usar sem prejudicar seu cultivo.
O post Estas 5 plantas adoram casca de banana: crescem mais rápido, ficam mais fortes e mais bonitas apareceu primeiro em C…","These 5 plants love banana peels: they grow faster, become stronger and more beautiful. Banana peel as a natural fertilizer helps with plant growth, flowering and roots. Understand how to use it without harming your cultivation.
The post These 5 plants love banana peels: they grow faster, become stronger and more beautiful appeared first in C…","Hae 5 plantae amant Musa caepe: crescunt velocius, fiunt robustiores et pulchriores. Baca cortices ut naturalis stercorat adiuvat ad incrementum plantarum, florum et radices. Intellige uti sine laesione culturae tuae.
Post Hae 5 plantae Musam amasiae amant: crescunt, robustiores fiunt et pulchriores apparuerunt primum in C…",https://catracalivre.com.br/noticias/estas-5-plantas-adoram-casca-de-banana-crescem-mais-rapido-ficam-mais-fortes-e-mais-bonitas/,https://i.catracalivre.com.br/t5wFmuYJPKPmwqZNNw2Mjngt5J4=/1200x630/smart/filters:quality(60)/catracalivre.com.br/wp-content/uploads/2026/05/magnific-casca-de-banana-sendo-ent-2901111034.jpg,,"Entre os adubos caseiros em alta, a casca de banana virou estrela: é barata, aparece fácil na cozinha e concentra nutrientes que favorecem o crescimento, o enraizamento e a floração das plantas, desd… [+3716 chars]",,2026-05-05 07:24:38+00:00,random,,,
0d241a538cf99785845e022566bf33fb,2026-05-03T14:36:28Z,Wildfire,incêndio florestal em Andhra Pradesh,catracalivre.com.br,pt,0.3,"In Holland ist der Farn gegen alles resistent, weil man ihn nie in der Nähe von Zugluft stehen lässt. Erfahren Sie mit praktischen Tipps zur Positionierung und täglichen Pflege, wie Sie dafür sorgen, dass Ihre Pflanzen immer üppig und gesund bleiben und vergilbende Blätter vermeiden.
Der Beitrag In Holland ist der Farn resistent gegen alles, weil er nie in der Nähe von Zugluft steht …","Na Holanda a samambaia é resistente a tudo, porque nunca a deixam perto de correntes de ar","Aprenda como manter as suas plantas sempre exuberantes e saudáveis, evitando folhas amareladas com dicas práticas de posicionamento e cuidados diários.
O post Na Holanda a samambaia é resistente a tudo, porque nunca a deixam perto de correntes de ar apareceu …","In Holland, the fern is resistant to everything, because they never leave it near drafts. Learn how to keep your plants always lush and healthy, avoiding yellowing leaves with practical tips on positioning and daily care.
The post In Holland, the fern is resistant to everything, because they never leave it near drafts appeared …","In Hollandia filix omnibus renititur, quia prope haustu numquam discedunt. Disce quomodo plantas tuas semper laetissimas et sanas servare, vitans folia flaventia cum apicibus practicis in positione et cura quotidiana.
Stipes In Hollandia filix omnibus renititur, quia numquam prope haustus exeunt visus...",https://catracalivre.com.br/noticias/na-holanda-a-samambaia-e-resistente-a-tudo-porque-nunca-a-deixam-perto-de-correntes-de-ar/,https://i.catracalivre.com.br/8BQLW98atjuDRS6ouIBAqe7rN58=/1200x630/smart/filters:quality(60)/catracalivre.com.br/wp-content/uploads/2026/05/magnific-samambaia-nephrolepis-exa-2901351491.jpg,,Criar um ambiente interno agradável e acolhedor exige cuidados específicos para que as suas companheiras verdes cresçam exuberantes e cheias de vida. Muitas pessoas sofrem constantemente ao verem as … [+5302 chars],,2026-05-05 07:24:38+00:00,wmo,India,SAS,Asia
87169101d3bce09e26aad856e8fce7b2,2026-05-03T16:16:10Z,Drought,seca no Paraguai,catracalivre.com.br,pt,0.3,"Schützen Sie Ihre Pflanzen mit geschnittenen Plastikflaschen: der ultimative und äußerst wirksame Trick, um Schädlinge von den Setzlingen in Ihrem Garten fernzuhalten. Der Einsatz von Plastikflaschen zum Schutz von Setzlingen liegt voll im Trend und hilft gegen Wind, starke Sonne und Schädlinge, ohne dass dafür nahezu Kosten für den Garten anfallen.
Der Beitrag Schützen Sie Ihre Pflanzen mit geschnittenen Plastikflaschen: der ultimative und superwirksame Trick, um Schädlinge von Ihren Setzlingen fernzuhalten …",Proteja suas plantas com garrafas pet cortadas: o truque definitivo e super eficaz para manter as pragas longe das mudas do seu jardim,"Usar garrafa pet para proteger mudas virou tendência e ajuda contra vento, sol forte e pragas sem gastar quase nada no jardim.
O post Proteja suas plantas com garrafas pet cortadas: o truque definitivo e super eficaz para manter as pragas longe das mudas do s…","Protect your plants with cut plastic bottles: the definitive and super effective trick to keep pests away from the seedlings in your garden. Using plastic bottles to protect seedlings has become a trend and helps against wind, strong sun and pests without spending almost anything on the garden.
The post Protect your plants with cut plastic bottles: the definitive and super effective trick to keep pests away from your seedlings…","Protege plantas tuas cum utribus plasticis sectis: dolum definitivum et supervacaneum ad custodiendas pestes a plantationibus in horto tuo. Plastic utres utres ad tuendos plantationes inclinatio facta est et adiuvat contra ventum, solem validum et pestes sine ullius fere in horto expendendo.
Stipes plantas tuas protege cum utribus plasticis sectis: dolum definitivum et super efficacem ad custodiendas pestes ab plantationibus tuis...",https://catracalivre.com.br/noticias/proteja-suas-plantas-com-garrafas-pet-cortadas-o-truque-definitivo-e-super-eficaz-para-manter-as-pragas-longe-das-mudas-do-seu-jardim/,https://i.catracalivre.com.br/6vqV9eT_8K9pBXlnxX6GCKBAVLg=/1200x630/smart/filters:quality(60)/catracalivre.com.br/wp-content/uploads/2026/05/magnific-muda-jovem-protegida-por-2901323625.jpg,,"Cuidar de mudinha nova é quase como proteger um bebê: qualquer descuido derruba. Vento, frio, sol forte, bicho, cachorro correndo pelo quintal tudo isso pode detonar o canteiro em segundos. E é aí qu… [+3299 chars]",,2026-05-05 07:24:38+00:00,edo,Paraguay,SES,South-America
4c23698bb0daabfeb76cd6a3d4f6e893,2026-05-03T16:31:31Z,ice jam,inundação,www.bbc.com,pt,0.3,"„Einer der unwirtlichsten Orte der Erde“: die grüne „Utopie“ der 1960er Jahre, die versuchte, die Welt neu zu erfinden. Um zu überleben, war das Dorf auf hausgemachte Erfindungen angewiesen, von kostengünstigen Solarwarmwasserbereitern und einer Kinderwippe, die gleichzeitig als Wasserpumpe dient, bis hin zu essbaren Waldgärten und Biokraftstoffen.",'Um dos lugares mais inóspitos da Terra': a 'utopia' verde dos anos 1960 que tentou reinventar o mundo,"A aldeia dependia de invenções caseiras para sobreviver, desde aquecedores solares de água de baixo custo e uma gangorra infantil que também funciona como bomba de água, até hortas florestais comestíveis e biocombustíveis","'One of the most inhospitable places on Earth': the 1960s green 'utopia' that tried to reinvent the world. The village depended on homemade inventions to survive, from low-cost solar water heaters and a children's seesaw that doubles as a water pump, to edible forest gardens and biofuels.","'Unus ex locis inhospitalibus in Terra': 1960 viridis 'utopia' quae mundum reficere conatus est. Vicus e inventis homemades superstes penderet, ex aqua solaris calentium et liberorum sessaw quae instar aquae sentinae duplicat, ad hortos sylvestres et biofuels eduntur.",https://www.bbc.com/portuguese/articles/cm2p4eejdnjo,https://ichef.bbci.co.uk/news/1024/branded_portuguese/acba/live/a39da660-37f1-11f1-9d5c-8ba507d7dbde.jpg,,"Crédito, Gaviotas
Legenda da foto, Nas instalações da Gaviotas, a aprendizagem acontece através de uma abordagem do tipo ""traga seu filho para o trabalho"", com coordenadores de grupo ensinando infor… [+17917 chars]",,2026-05-05 07:24:38+00:00,random,,,
0a423ce3a06ed9026879b144b7d9a638,2026-05-03T17:06:29Z,Wildfire,incêndio florestal em gujarat,catracalivre.com.br,pt,0.3,"Damit die Boa constrictor in Thailand jahrelang haltbar ist, besteht der Trick darin, den Topf nicht zu gießen, aber niemals auf dem Boden stehen zu lassen. Lernen Sie das thailändische Geheimnis kennen, Töpfe hochzustellen, um die hängenden Blätter vor Kälte und Fäulnis zu schützen und so eine lange Lebensdauer im Innenbereich zu gewährleisten.
Der Beitrag Damit die Boa constrictor in Thailand jahrelang hält: Der Trick besteht darin, nicht zu gießen, aber den Topf niemals auf dem Boden stehen zu lassen …","Na Tailândia, para a jiboia durar anos: o macete não é a rega, mas nunca deixar o vaso no chão","Aprenda o segredo tailandês de elevar os vasos para proteger suas folhagens pendentes do frio e do apodrecimento, garantindo uma vida longa dentro de casa.
O post Na Tailândia, para a jiboia durar anos: o macete não é a rega, mas nunca deixar o vaso no chão a…","In Thailand, for the boa constrictor to last for years: the trick is not watering, but never leaving the pot on the ground. Learn the Thai secret of elevating pots to protect their hanging foliage from cold and rot, ensuring a long life indoors.
The post In Thailand, for the boa constrictor to last for years: the trick is not watering, but never leaving the pot on the ground…","In Thailandia, boa constrictor per annos durabit: dolus non rigat, sed ollam in terra numquam relinquit. Disce Thai secretum ollas elevandi, ut folia a frigore et putredine pendentia defendat, longam domesticas vitam procurans.
Stipes In Thailandia, boa constrictor per annos durabit: dolus non rigat, sed ollam in terra numquam relinquit.",https://catracalivre.com.br/noticias/na-tailandia-para-a-jiboia-durar-anos-o-macete-nao-e-a-rega-mas-nunca-deixar-o-vaso-no-chao/,https://i.catracalivre.com.br/nZczAjedDDn3ZI5Z7MMWKuxTO6k=/1200x630/smart/filters:quality(60)/catracalivre.com.br/wp-content/uploads/2026/05/magnific-vaso-de-jiboia-suspenso-e-2901350950.jpg,,"Muitos iniciantes na jardinagem perdem suas trepadeiras por apodrecimento, acreditando que o problema seja sempre o excesso de água oferecida durante a rega semanal. No entanto, um costume milenar ta… [+5151 chars]",,2026-05-05 07:24:38+00:00,wmo,India,SAS,Asia
fd8679157c67400df7726d9e291ecc80,2026-05-03T20:16:49Z,Precipitation,chuva torrencial leiria,catracalivre.com.br,pt,0.3,"Warum sollten Sie anfangen, Kaffeesatz auf Ihrem Rasen zu verteilen? Die Verwendung von Kaffeesatz auf Ihrem Rasen hilft mit einem einfachen und nachhaltigen Trick, den Boden zu stärken und das Gras grüner zu machen.
Der Beitrag Warum sollten Sie anfangen, Kaffeesatz auf Ihrem Rasen zu verteilen? erschien zuerst auf Catraca Livre.",Por que você deveria começar a espalhar borra de café no seu gramado?,"Usar borra de café no gramado ajuda a fortalecer o solo e deixar a grama mais verde com um truque simples e sustentável.
O post Por que você deveria começar a espalhar borra de café no seu gramado? apareceu primeiro em Catraca Livre.","Why should you start spreading coffee grounds on your lawn? Using coffee grounds on your lawn helps strengthen the soil and make the grass greener with a simple and sustainable trick.
The post Why should you start spreading coffee grounds on your lawn? appeared first on Catraca Livre.","Cur committitur patulas capulus capita in gramina tua? Utens capulus rationes in gramina tua adiuvat terram confirma et herbam viridiorem fac cum fraude simplici et sustinebili.
Stipes Cur incipere debes patulas capulus causas in gramina tua? apparuit primo in Catraca Livre.",https://catracalivre.com.br/noticias/por-que-voce-deveria-comecar-a-espalhar-borra-de-cafe-no-seu-gramado-2/,https://i.catracalivre.com.br/R_F5l_jpkjX2ZvVCHyiMpA_GEYY=/1200x630/smart/filters:quality(60)/catracalivre.com.br/wp-content/uploads/2026/05/magnific-borra-de-cafe-sendo-espal-2901323247.jpg,,"Aplicar restos de café no gramado tem chamado atenção de quem quer cuidar do jardim de um jeito mais natural, reaproveitando um resíduo do dia a dia. Em vez de jogar a borra no lixo, dá para transfor… [+3553 chars]",,2026-05-05 07:24:38+00:00,wmo,Portugal,MED,Europe
f913609828f18dcdf9fd584ab71852d8,2026-05-03T04:56:32Z,Drought,seca,catracalivre.com.br,pt,0.9,"Die Pflanze, die kein Wasser braucht, die Wärme liebt und den Garten in eine Oase für Schmetterlinge verwandelt. Entdecken Sie, wie Sie den hitze- und dürreresistenten Sommerflieder, den Schmetterlingsbaum, züchten. Ideal für nachhaltige Gärten, mit geringem Pflegeaufwand und anziehender Fauna.
Der Beitrag Die Pflanze, die kein Wasser braucht, die Wärme liebt und den Garten in eine Schmetterlingsoase verwandelt …","A planta que não precisa de água, ama o calor e transforma o jardim num oásis de borboletas","Descubra como cultivar Buddleia, a árvore das borboletas, resistente ao calor e à seca. Ideal para jardins sustentáveis, com pouca manutenção e atração de fauna.
O post A planta que não precisa de água, ama o calor e transforma o jardim num oásis de borboleta…","The plant that doesn't need water, loves the heat and turns the garden into an oasis for butterflies. Discover how to grow heat- and drought-resistant Buddleia, the butterfly tree. Ideal for sustainable gardens, with little maintenance and attracting fauna.
The post The plant that doesn’t need water, loves the heat and turns the garden into a butterfly oasis…","Planta quae aqua non indiget, calorem amat et hortum in oasis papilionis vertit. Invenite quomodo crescere calor- et siccitatis repugnans Buddleia, papilio arbor. Specimen pro hortis sustinendis, cum fauna parum sustentationis attrahens.
Planta quae aqua non indiget, calorem amat et hortum in papilio oasis vertit…",https://catracalivre.com.br/noticias/a-planta-que-nao-precisa-de-agua-ama-o-calor-e-transforma-o-jardim-num-oasis-de-borboletas/,https://i.catracalivre.com.br/33gynCtaCr08vQUL9cSfdIfdxNQ=/1200x630/smart/filters:quality(60)/catracalivre.com.br/wp-content/uploads/2026/05/magnific-buddleia-em-flor-com-espi-2901734957.jpg,,"Existe uma planta que cresce bem onde outras murcham, não reclama de estiagem, floresce em tons que vão do roxo intenso ao branco puro e ainda atrai borboletas em quantidade. A Buddleia, conhecida po… [+4656 chars]",,2026-05-05 07:24:38+00:00,random,,,
1b9a0bac084df77d63bd26b2c926a0cc,2026-05-04T05:30:00Z,Cold Wave,queda de temperatura,ultimosegundo.ig.com.br,pt,0.8,Diese Woche wird es die bisher stärkste Kaltfront des Jahres 2026 geben. Veränderungen im atmosphärischen Muster führen in einigen Regionen Brasiliens zu Instabilität und einem erheblichen Temperaturabfall; Überprüfen Sie die Wettervorhersage,Semana vai ter frente fria mais forte de 2026 até agora,Mudança no padrão atmosférico traz instabilidade e queda expressiva de temperatura em algumas regiões do Brasil; confira a previsão,This week will have the strongest cold front of 2026 so far. Changes in the atmospheric pattern bring instability and a significant drop in temperature in some regions of Brazil; check the forecast,Haec septimana fortissimum frigus ante annum MMXXVI erit. Mutationes in exemplari atmosphaerico instabilitatem afferunt et guttam notabilem temperie in nonnullis Brasiliae regionibus; praenuntientur reprehendo,https://ultimosegundo.ig.com.br/2026-05-04/semana-vai-ter-frente-fria-mais-forte-de-2026-ate-agora.html,https://i0.statig.com.br/bancodeimagens/f4/ri/x6/f4rix6wnf3m6lyw3s07ne4180.jpg,,"A semana entre os dias 4 e 10 de maio de 2026 será marcada pela atuação do sistema mais intenso do ano até agora, com previsão de chuva volumosa, temporais e queda significativa de temperatura em div… [+2794 chars]",,2026-05-06 03:57:20+00:00,random,,,
