index,published,topic,term,domain,language,valid,de,title,description,en,la,url,image,archive,content,quote,added,feed,country,ipcc,continent
9b88db360a9124183f6fa76a9ac7c49a,2026-05-24T01:07:45Z,Storm,tempestade chile,www.terra.com.br,pt,0.3,"F1: Bortoleto verrät, dass das Audi-Auto vor dem GP von Kanada Probleme hat. Der Brasilianer berichtete, dass er Schwierigkeiten mit dem Gleichgewicht in der Wertung hatte, in der er beim Rennen in Montreal den 13. Platz in der Startaufstellung belegte",F1: Bortoleto revela que carro da Audi tem problemas antes de GP do Canadá,Brasileiro relatou que teve dificuldades com balanço na classificação em que cravou o 13º lugar no grid de largada da corrida em Montreal,F1: Bortoleto reveals that Audi car has problems before Canadian GP. Brazilian reported that he had difficulties with balance in the classification in which he placed 13th on the starting grid of the race in Montreal,F1: Bortoleto indicat Audi car difficultates habere ante Canadian GP. Brasiliensium nuntiavit se aequabilitate difficultatum habuisse in classificatione qua 13 in primordio emissione generis in Montrealensi collocavit.,"https://www.terra.com.br/esportes/automobilismo/f1-bortoleto-revela-que-carro-da-audi-tem-problemas-antes-de-gp-do-canada,00f9be0f0dbf6ea2415c8850c4fd1342zkbo8gez.html",https://s1.trrsf.com/update-1698692222/fe/zaz-mod-t360-icons/svg/logos/terra-16x9-borda.png,,"O brasileiro Gabriel Bortoleto, da Audi, conseguiu a 13ª posição no grid de largada para o GP do Canadá de Fórmula 1 e afirmou que neste sábado, 23, o comportamento de seu carro mudou muito em relaçã… [+1550 chars]",,2026-06-04 08:57:08+00:00,wmo,Chile,SWS,South-America
9efe81cdf17b2df206ac5d7af7b118b0,2026-05-24T13:20:04Z,Snow&Ice,neve estados unidos,www.uol.com.br,pt,0.3,"Keiner. Die kanadische Strecke liefert normalerweise gute Rennen und das sollte auch bei dem Rennen, das an diesem Sonntag um 17 Uhr brasilianischer Zeit beginnt, nicht anders sein. Wie beim Sprint startet George Russell mit seinem Mercedes-K-Teamkollegen als Erster",,"A pista do Canadá costuma entregar boas corridas e não deve ser diferente na prova que tem largada às 17h deste domingo, pelo horário de Brasília. A exemplo do que aconteceu na sprint, George Russell larga em primeiro, com seu companheiro de Mercedes K","None. The Canadian track usually delivers good races and it should be no different in the race that starts at 5pm this Sunday, Brasília time. Like what happened in the sprint, George Russell starts first, with his Mercedes K teammate","Nulli. Canadensis semita plerumque bonas gentes liberat et non differre debet in stadio quod 5 post meridiem incipit hoc die Dominico, Brasília tempore. Sicut quod factum est in concitu, George Russell primus incipit cum suis Mercedes K teammate",https://www.uol.com.br/esporte/colunas/pole-position/2026/05/24/mais-um-russell-x-antonelli-com-tempero-de-chuva-o-que-esperar-do-gp.htm,https://conteudo.imguol.com.br/c/esporte/b4/2026/05/23/russell-e-antonelli-disputam-a-ponta-na-sprint-do-gp-do-canada-1779555598549_v2_615x300.jpg,,"Vamos ver quanta chuva vai cair, mas vai ficar ainda mais frio do que nestes dois dias; então, obviamente, quando chove e faz frio, a aderência já é muito baixa. E, além disso, é claro, esta não é um… [+989 chars]",,2026-06-04 08:57:08+00:00,wmo,United States,CNA,North-America
58cf0a96ecd43d38864574a2b799fc78,2026-05-24T20:47:55Z,Earthquake,terremoto chile,www.terra.com.br,pt,0.3,"F1: Verspäteter Start und falsche Wahl von McLaren markieren den Start des GP von Kanada. Norris und Piastri starten auf Intermediate-Reifen, während Mercedes-Piloten in den ersten Runden um die Führung kämpfen",F1: Atraso na largada e escolha errada da McLaren marcam o início do GP do Canadá,Norris e Piastri largam de pneus intermediários enquanto pilotos da Mercedes disputam liderança nas primeiras voltas,F1: Delayed start and wrong choice by McLaren mark the start of the Canadian GP. Norris and Piastri start on intermediate tires while Mercedes drivers fight for the lead in the first laps,F1: Initium et malum electionis a McLaren notare initium Canadiensis GP moratus est. Norris et Piastri in intermedias coronas incipiunt dum aurigae Mercedes primo lapso pro plumbo pugnant,"https://www.terra.com.br/esportes/automobilismo/formula1/f1-atraso-na-largada-e-escolha-errada-da-mclaren-marcam-o-inicio-do-gp-do-canada,befaebfabb69c448b53b1c1c4eea30ed9vmelfbz.html",https://p2.trrsf.com/image/fget/cf/1200/630/middle/images.terra.com/2026/05/24/image(21)-rhdbylyudpo4.jpg,,A largada do GP do Canadá foi marcada por atraso e escolha errada da McLaren com os pneus intermediários. Enquanto Arvid Lindbald precisou recolher o carro para a garagem da Racing Bulls devido a uma… [+924 chars],,2026-06-04 08:57:08+00:00,usgs,Chile,SWS,South-America
c31568f5ca11bf8607e9c7dde6343ab5,2026-05-24T21:55:02Z,Drought,falta de chuva letónia,www.uol.com.br,pt,0.3,Keiner. Formel-1-Meisterschaftsführer Kimi Antonelli gewann nach einem elektrisierenden Streit mit seinem Mercedes-Teamkollegen George Russell beim GP von Kanada das vierte Rennen in Folge. Der intensive Kampf dauerte 30 Runden und endete mit einem Motorschaden.,,"O líder do campeonato da Fórmula 1, Kimi Antonelli, venceu a quarta corrida seguida depois de uma eletrizante disputa com seu companheiro de Mercedes, George Russell, no GP do Canadá. A batalha intensa durou 30 voltas e acabou com a quebra do motor do",None. Formula 1 championship leader Kimi Antonelli won the fourth race in a row after an electrifying dispute with his Mercedes teammate George Russell at the Canadian GP. The intense battle lasted 30 laps and ended with the engine breaking down.,"Nulli. Formula 1 patrocinium ducis Kimi Antonelli quartae gentis in ordine vicit post controversiam electrifying cum Mercedes teammate George Russell in Canadensis GP. Pugnatum est vehemens 30 gremiis, et diremit machinam perfringens.",https://www.uol.com.br/esporte/ultimas-noticias/2026/05/24/gp-do-canada.ghtm,https://conteudo.imguol.com.br/c/esporte/70/2026/05/24/kimi-antonelli-e-george-russell-lado-a-lado-em-disputa-no-gp-do-canada-1779657545946_v2_615x300.jpg,,"E Gabriel Bortoleto terminou fora dos pontos com a Audi após um erro estratégico no início da prova. O brasileiro foi o 13º.
Mesmo após apenas uma garoa leve, as McLaren, Audi, Cadillac e Carlos Sai… [+1695 chars]",,2026-06-04 08:57:08+00:00,edo,Latvia,WCE,Europe
79586491645f67eee594118cd8e18352,2026-05-24T23:29:18Z,Storm,tempestade portalegre,www.terra.com.br,pt,0.3,"F1: Bortoleto bedauert die Strategie von Audi, nachdem er in Kanada die Chance auf ein Tor verpasst hat. Der Brasilianer glaubt, dass ihn die falsche Reifenwahl am Start eine mögliche Top-10-Platzierung in Montreal gekostet hat",F1: Bortoleto lamenta estratégia da Audi após perder chance de pontuar no Canadá,Brasileiro acredita que escolha errada dos pneus na largada custou um possível top-10 em Montreal,F1: Bortoleto regrets Audi's strategy after missing the chance to score in Canada. Brazilian believes that wrong tire choice at the start cost him a possible top-10 in Montreal,F1: Bortoleto paenitet Audi consilium postquam defuit facultas score in Canada. Brazilian credit quod iniuriam strigare electionem in initio constant ei possibile summo-10 in Montrealensi,"https://www.terra.com.br/esportes/automobilismo/formula1/f1-bortoleto-lamenta-estrategia-da-audi-apos-perder-chance-de-pontuar-no-canada,544d7b0b4c236337c0554edfbd000669riee4ivt.html",https://p2.trrsf.com/image/fget/cf/1200/630/middle/images.terra.com/2026/05/24/captura-de-tela-2026-05-24-as-20-27-29-ubuqlgjpfinq.png,,Gabriel Bortoleto deixou o GP do Canadá frustrado com o resultado da Audi neste domingo. O brasileiro terminou apenas na 13ª colocação e avaliou que a estratégia adotada pela equipe na largada compro… [+1039 chars],,2026-06-04 08:57:08+00:00,wmo,Portugal,MED,Europe
4b44d65eae25ad179a7b81ceb7210e0c,2026-05-25T00:00:16Z,Heat Wave,onda de calor no Canadá,www.terra.com.br,pt,0.3,"F1: Norris bedauert den Abbruch des GP von Kanada, sieht aber Fortschritte bei McLaren. Lando Norris verließ das Rennen mit gemischten Gefühlen, nachdem er sich einer riskanten Strategie gestellt hatte und...","F1: Norris lamenta abandono no GP do Canadá, mas vê evolução da McLaren",Lando Norris deixou a corrida com sentimentos mistos após enfrentar uma estratégia arriscada e ...,"F1: Norris regrets abandoning the Canadian GP, ​​but sees McLaren's progress. Lando Norris left the race with mixed feelings after facing a risky strategy and...","F1: Norris dolet de Canadian GP deserere, sed profectum McLaren videt. Lando Norrisius genus reliquerat mixtis affectibus, adversus periculosum consilium et ...","https://www.terra.com.br/esportes/automobilismo/formula1/f1-norris-lamenta-abandono-no-gp-do-canada-mas-ve-evolucao-da-mclaren,d374da2bb241d556ae8d461286d76672uxbpaz2l.html",https://p2.trrsf.com/image/fget/cf/1200/630/middle/images.terra.com/2026/05/24/hjcwfs-w0aaypif-1hv0giwtt5g83.jpeg,,Lando Norris deixou a corrida com sentimentos mistos após enfrentar uma estratégia arriscada e uma falha que o tirou da prova. O piloto da McLaren reconheceu que a decisão tomada pela equipe nas prim… [+2489 chars],,2026-06-04 08:57:08+00:00,wmo,Canada,NEN,North-America
67b4cfab62fce158c72acc9aa0aa19f9,2026-05-25T09:39:11Z,Drought,falta de chuva macau,www.terra.com.br,pt,0.3,"F1: McLaren verteidigt die Reifenwahl in Kanada und bestreitet, dass die Strategie „dumm“ gewesen sei. Das Team erklärte, dass der Einsatz von Intermediate-Reifen durch Verzögerungen am Start und schnelles Abtrocknen der Strecke erschwert wurde","F1: McLaren defende escolha de pneus no Canadá e nega que estratégia tenha sido ""estúpida""",Equipe justificou que a aposta nos pneus intermediários foi prejudicada por atrasos na largada e secagem rápida da pista,"F1: McLaren defends tire choice in Canada and denies that strategy was ""stupid"". The team explained that the bet on intermediate tires was hampered by delays at the start and rapid drying of the track","F1: McLaren electionem tire in Canada defendit et consilium ""stultum"" esse negat. Turma explicavit quod pignore inter coronas in initio moras impeditum et celeri siccatione vestigii","https://www.terra.com.br/esportes/automobilismo/formula1/f1-mclaren-defende-escolha-de-pneus-no-canada-e-nega-que-estrategia-tenha-sido-estupida,5fb585812a780f8eafb18c32fc2d1dfe1fmar8aw.html",https://p2.trrsf.com/image/fget/cf/1200/630/middle/images.terra.com/2026/05/25/imagem_2026-05-25_063742233-1h84s05bo12sl.png,,"Apesar de ter prejudicado drasticamente sua corrida no Grande Prêmio do Canadá de Fórmula 1, a McLaren segue convicta de que largar com pneus intermediários não foi uma decisão equivocada. Segundo La… [+3334 chars]",,2026-06-04 08:57:08+00:00,edo,Macao,EAS,Asia
41e25fb286e590348f30c818fc028d57,2026-05-29T10:30:56Z,Thunderstorm,tempo severo Guiné,www.purepeople.com.br,pt,0.3,"Und was ist damit, Neymar?! Der Spieler erhält von Bruna Biancardi eine eindringliche Warnung bezüglich Ex-Amanda Kimberlly und der Weltmeisterschaft 2026, heißt es in der Zeitung. Neymar steht bei der Weltmeisterschaft 2026 vor einer beispiellosen Herausforderung, die über das Spielfeld hinausgeht. Während sich die Fans um seine Genesung sorgen, sorgt ein Familienstreit hinter den Kulissen der Weltmeisterschaft für Aufruhr","E mais essa, Neymar?! Jogador ganha forte aviso de Bruna Biancardi envolvendo ex Amanda Kimberlly e a Copa do Mundo 2026, diz jornal","Neymar encara um desafio inédito para a Copa do Mundo 2026, que vai além do gramado. Enquanto a torcida se preocupa com sua recuperação, uma disputa familiar promete agitar os bastidores do Mundial","And what about this, Neymar?! Player receives strong warning from Bruna Biancardi involving ex Amanda Kimberlly and the 2026 World Cup, says newspaper. Neymar faces an unprecedented challenge for the 2026 World Cup, which goes beyond the pitch. While the fans worry about his recovery, a family dispute promises to shake things up behind the scenes at the World Cup","Quid hoc, Neymar? Ludio ludius fortiter monitum accipit de Bruna Biancardi, quae ex Amanda Kimberlly et 2026 World Cup, acta diurna dicit. Neymar provocationem inauditam ob 2026 Trophaeum Mundi, quod picem excedit. Dum in fans de recuperatione eius solliciti sunt, controversia familiaris promittit se res movere post scaenas in Trophaeum Mundi", https://www.purepeople.com.br/noticia/neymar-lesao-grau-2-na-panturrilha-e-outro-problema-para-jogador-da-copa-2026-nova-polemica-envolve-bruna-biancardi-e-ex-amanda-kimberlly_a420444/1 ,https://p2.trrsf.com/image/fget/cf/1200/630/middle/images.terra.com/2026/05/29/984037648-63863bca87d57e73-1400x823-1.jpg,,"Neymar tem um problema a mais para resolver envolvendo a Copa do Mundo 2026. Diagnosticado com lesão grau 2 na panturrilha, o atacante corre risco de ser cortado do Mundial, em caso semelhante ao de … [+2065 chars]",,2026-06-04 08:57:08+00:00,wmo,Guinea,WAF,Africa
290ccf9b50d81c06ed3775a0f9f9a44e,2026-05-31T23:15:36Z,Precipitation,chuva torrencial braga,observador.pt,pt,0.3,"Von der Bruxelles-Zweideutigkeit bis zur Dringlichkeit des Jahres 2030. Der Horizont, den Europa vor sich hat, besteht nicht und hat auch nie darin bestanden, die NATO durch etwas anderes zu ersetzen. Es ist gleichzeitig etwas Bescheideneres und Anspruchsvolleres: sich verteidigen zu können",Da ambiguidade Bruxelloise à urgência de 2030,"O horizonte que a Europa tem à sua frente não é, nem nunca foi, substituir a NATO por outra coisa qualquer. É algo, simultaneamente, mais modesto e mais exigente: ser capaz de se defender por si mesma","From the Bruxelloise ambiguity to the urgency of 2030. The horizon that Europe has in front of it is not, and never has been, replacing NATO with something else. It is something, simultaneously, more modest and more demanding: being able to defend yourself","Ex ambiguitate Bruxelloise urgente 2030. Horizontem Europam ante non est, nec umquam aliud reposuit NATO. Est aliquid simul, modestius ac magis insecundum: posse te defendere",https://observador.pt/opiniao/da-ambiguidade-bruxelloise-a-urgencia-de-2030/,https://wm.observador.pt/wm-op/wide-circle/https%3A%2F%2Fbordalo.observador.pt%2Fv2%2Frs%3Afill%3A900%2Fc%3A763%3A763%3Anowe%3A209%3A248%2Fq%3A70%2Ff%3Awebp%2Fplain%2Fhttps%3A%2F%2Fs3.observador.pt%2Fwp-content%2Fuploads%2F2021%2F02%2F15172400%2Fhelder-sousa-silva-presidente-da-cm-mafra.jpg,,"Existem expressões de Bruxelas, que aparecem nas conclusões dos Conselhos Europeus, as quais são repetidas, inúmeras vezes, em conferências de imprensa e regressam, sistematicamente, em estratégias, … [+6427 chars]",,2026-06-04 08:57:08+00:00,wmo,Portugal,MED,Europe
029f03f978a9c31d4ca1271e8edfccee,2026-05-23T23:16:25Z,Precipitation,chuva Canadá,www.terra.com.br,pt,0.8,"F1 2026: Hamilton ist von der Regenwahrscheinlichkeit ermutigt: „Vielleicht können wir Mercedes herausfordern.“ Der siebenmalige Champion glaubt, dass nasse Bedingungen Ferrari beim GP von Kanada näher an die Spitzenteams heranbringen könnten",F1 2026: Hamilton se anima com chance de chuva: “Talvez possamos desafiar a Mercedes”,Heptacampeão acredita que condições molhadas podem aproximar Ferrari das equipes da frente no GP do Canadá,F1 2026: Hamilton is encouraged by the chance of rain: “Maybe we can challenge Mercedes”. Seven-time champion believes wet conditions could bring Ferrari closer to the front teams at the Canadian GP,"F1 2026: Hamilton casu pluviae excitatur: ""Fortasse Mercedes provocare possumus"". Septem tempus assertor credit condiciones humidas Ferrari propius ad primas iunctiones in Canadian GP deducere posse","https://www.terra.com.br/esportes/automobilismo/formula1/f1-2026-hamilton-se-anima-com-chance-de-chuva-talvez-possamos-desafiar-a-mercedes,9380a8a1a5a36f5d4e8d94a7695124a744qxyjft.html",https://p2.trrsf.com/image/fget/cf/1200/630/middle/images.terra.com/2026/05/23/4c7ba56b-9198-460e-a3f8-8ffb82ff2aea-1iv9c0xsuvmlx.jpg,,"Lewis Hamilton demonstrou otimismo após garantir o quinto lugar no grid para o GP do Canadá e acredita que a chuva pode ajudar a Ferrari na corrida deste domingo em Montreal.
O britânico afirmou que… [+1344 chars]",,2026-06-04 08:57:08+00:00,wmo,Canada,NEN,North-America
4732f44421da9c679c0b5c30ee39ab6e,2026-05-23T23:31:30Z,Precipitation,chuva Canadá,www.terra.com.br,pt,0.8,"F1 2026: Piastri warnt vor Regengefahr beim GP von Kanada. McLaren-Fahrer sagt, dass das Rennen in Montreal aufgrund der Prognose für nasse Strecken zu einem „Unbekannten“ werden könnte",F1 2026: Piastri alerta para riscos da chuva no GP do Canadá,Piloto da McLaren diz que corrida em Montreal pode virar “uma incógnita” com previsão de pista molhada,F1 2026: Piastri warns of risks of rain at the Canadian GP. McLaren driver says race in Montreal could become “an unknown” with wet track forecast,"F1 2026: Piastri monet periculum pluviae in Canadiensi GP. McLaren coegi dicit genus in Montrealensi posse fieri ""incognitus"" infectum semita praenuntientur","https://www.terra.com.br/esportes/automobilismo/formula1/f1-2026-piastri-alerta-para-riscos-da-chuva-no-gp-do-canada,e58b0e63a4da2795c0eb192c39e2ef64zvt0ngda.html",https://p2.trrsf.com/image/fget/cf/1200/630/middle/images.terra.com/2026/05/23/hjcdtq7weaa4xb8-urv6gkwlsg1i.jpeg,,"Oscar Piastri acredita que o GP do Canadá porde se transformar em uma das corridas mais imprevisíveis da temporada. Com a previsão de chuva para a hora da prova, o piloto da McLaren destacou dois gra… [+649 chars]",,2026-06-04 08:57:08+00:00,wmo,Canada,NEN,North-America
1f7176095c25a4e243d6c35a3baf2347,2026-05-24T10:59:25Z,Precipitation,chuva Canadá,www.terra.com.br,pt,0.8,"F1 2026: Sehen Sie sich den Zeitplan, die Startaufstellung, die Wettervorhersage und den Ort an, an dem Sie den GP von Kanada sehen können. Da Mercedes und Russell auf den ersten beiden Plätzen stehen, besteht beim Rennen in Montreal eine hohe Regenwahrscheinlichkeit; Bortoleto startet vom 13","F1 2026: Confira horário, grid de largada, previsão do tempo e onde assistir ao GP do Canadá","Com dobradinha da Mercedes e Russell na pole, corrida em Montreal tem alta possibilidade de chuva; Bortoleto larga de 13º","F1 2026: Check the schedule, starting grid, weather forecast and where to watch the Canadian GP. With Mercedes and Russell on pole one-two, the race in Montreal has a high possibility of rain; Bortoleto starts from 13th","F1 2026: Perscriptio schedula, malesuada euismod incipiens, tempestas praenuntietur et ubi ad Canadian GP spectandum. Apud Mercedem et Russellum in polo unum et alterum genus in Montrealensi maximam possibilitatem habet pluviae; Bortoletus incipit a 13th","https://www.terra.com.br/esportes/automobilismo/formula1/f1-2026-confira-horario-grid-de-largada-previsao-do-tempo-e-onde-assistir-ao-gp-do-canada,9ac3b3077d0c8c3cde7c53929a317e43szzxh1r5.html",https://p2.trrsf.com/image/fget/cf/1200/630/middle/images.terra.com/2026/05/24/image(18)-1iyc8k2tp1ctx.jpg,,"Neste domingo (24) será realizado o GP do Canadá de F1 2026. Após a vitória de George Russell na sprint, o piloto da Mercedes volta a aparecer no topo, conquistando a pole position para a corrida pri… [+2182 chars]",,2026-06-04 08:57:08+00:00,wmo,Canada,NEN,North-America
e010100a20a6e352efc687dae43606fa,2026-05-24T19:44:25Z,Precipitation,chuva Canadá,www.terra.com.br,pt,0.8,"F1 2026: Trotz leichtem Nieselregen sollte der Regen vor dem Start in Kanada aufhören. Die Fahrer gehen auf Trockenreifen an die Startaufstellung, während die Teams von Unentschlossenheit beherrscht werden","F1 2026: Apesar de leve garoa, chuva deve parar antes da largada no Canadá","Pilotos se encaminham para o grid com pneus de pista seca, com indecisões tomando conta das equipes","F1 2026: Despite light drizzle, rain should stop before the start in Canada. Drivers head to the grid on dry tires, with indecision taking over the teams","F1 2026: Quamvis levis Proin, pluvia ante initium in Canada cessare debet. Coegi caput in malesuada euismod in fatigatis siccis, cum bicipiti cunctatione accepto","https://www.terra.com.br/esportes/automobilismo/formula1/f1-2026-apesar-de-leve-garoa-chuva-deve-parar-antes-da-largada-no-canada,f4f79a1a33737c7f034741dc2bd7aa29uvo672o6.html",https://p2.trrsf.com/image/fget/cf/1200/630/middle/images.terra.com/2026/05/24/image(20)-1ieuz9dtr27uf.jpg,,"Apesar da leve garoa em Montreal, chuva deve parar antes da largada do GP do Canadá. Na ida ao grid, os pilotos se encaminham com pneus de pista seca, se atentando ao setor 1, que continua levemente … [+1042 chars]",,2026-06-04 08:57:08+00:00,wmo,Canada,NEN,North-America
5af2203ca2c5944767c82bf5a0db5921,2026-05-22T05:43:46Z,Precipitation,precipitação westland ao sul de hokitika,observador.pt,pt,0.3,Häusliche Gewalt. Die Behörden nehmen jeden Tag neun Personen fest. Expresso: Im ersten Quartal dieses Jahres wurden 800 Menschen festgenommen. PSP und GNR verzeichneten täglich 80 Vorfälle. Jornal de Notícias: Die Investitionen in die Eisenbahn gehen zurück und die Verspätungen nehmen zu.,Violência doméstica. Autoridades detêm 9 pessoas a cada dia,"Expresso: No primeiro trimestre deste ano, foram detidas 800 pessoas. PSP e GNR registaram 80 ocorrências diárias. Jornal de Notícias: Investimento na ferrovia está em queda e os atrasos agravam-se.","Domestic violence. Authorities detain 9 people each day. Expresso: In the first quarter of this year, 800 people were detained. PSP and GNR recorded 80 daily incidents. Jornal de Notícias: Investment in the railway is falling and delays are getting worse.",Domestica violentia. Auctoritates detinent VIIII homines per dies singulos. Expresso: In quarta huius anni prima DCCC homines detenti sunt. PSP et GNR 80 cotidie incident. Jornal de Notícias: Obsideri in ferriviaria cadit et morae pejus sunt.,https://observador.pt/programas/conferencia-de-imprensa/violencia-domestica-autoridades-detem-9-pessoas-a-cada-dia-2/,https://bordalo.observador.pt/v2/rs:fill:770:403/c:770:433:nowe:0:0/q:70/f:webp/plain/https://s3.observador.pt/wp-content/uploads/2022/04/10163300/770-podcast-conferencia-de-imprensa.jpg,,Esta transcrição foi gerada automaticamente por Inteligência Artificial e pode conter erros ou imprecisões.Bom dia. Conferência de imprensa da Rádio Observador. Passamos em revista o que dizem os jor… [+4768 chars],,2026-06-04 12:50:26+00:00,wmo,New Zealand,NZ,Oceania
430f86ae1845cc9bfbd9c8ce53dba41a,2026-05-05T09:31:53Z,Storm,tempestade na Nova Zelândia,catracalivre.com.br,pt,0.3,"Das Schwert des Heiligen Georg: Wie man es im Herbst beschneidet und wie oft. Der Schnitt des St.-Georgs-Schwerts muss im Frühjahr erfolgen, um die Keimung anzuregen und Pilzbefall zu vermeiden. Verstehen Sie, wann Sie schneiden müssen und wie Sie das Rhizom schützen.
Der Beitrag Das Schwert von São Jorge: wie man es im Herbst beschneidet und wie oft erschien zuerst in Catraca Livre.",Espada-de-são-jorge: como podá-la no outono e com que frequência,"A poda da espada-de-são-jorge precisa acontecer na primavera para estimular brotos e evitar fungos. Entenda quando cortar e como proteger o rizoma.
O post Espada-de-são-jorge: como podá-la no outono e com que frequência apareceu primeiro em Catraca Livre.",Saint George's sword: how to prune it in autumn and how often. Pruning the St. George's Sword needs to happen in spring to stimulate sprouts and prevent fungus. Understand when to cut and how to protect the rhizome. The post São Jorge's Sword: how to prune it in autumn and how often appeared first in Catraca Livre.,S. Georgii gladius: autumno et quotiens. Gladii S. Georgii putatio accidere debet vere ut pullulat et ne fungus excitet. Intellige quando secare et quomodo rhizomate tegere. Gladius São Jorge: quomodo id autumno putes et quotiens primum in Catraca Livre apparuit.,https://catracalivre.com.br/noticias/espada-de-sao-jorge-como-poda-la-no-outono-e-com-que-frequencia/,https://i.catracalivre.com.br/LSXgb-jTfpeSGSOWE6kaAFWugKw=/1200x630/smart/filters:quality(60)/catracalivre.com.br/wp-content/uploads/2026/05/magnific-espadadesaojorge-em-vaso-2920947831.jpg,,"A espada-de-são-jorge tem fama de ser indestrutível, e em grande parte é verdade. Mas essa resistência gerou um equívoco comum: muita gente poda a planta com frequência excessiva, acreditando que cor… [+5010 chars]",,2026-06-05 04:41:55+00:00,wmo,New Zealand,NZ,Oceania
