index,published,topic,term,domain,language,valid,de,title,description,en,la,url,image,archive,content,quote,added,feed,country,ipcc,continent
e614b81510ecb1f2b6a8eb6e6dbb981a,2026-07-02T10:18:30Z,Tropical Cyclone,ciclone,www.diariodocentrodomundo.com.br,pt,0.9,"Stürme und extreme Kälte: Außertropischer Wirbelsturm verändert das Klima in Brasilien. Es wird erwartet, dass eine Kaltfront, die mit der Bildung eines außertropischen Wirbelsturms im Ozean einhergeht, an diesem Donnerstag (2) in der Südregion für starken Regen sorgen und ab Freitag (3) zu einem plötzlichen Wetterumschwung im Südosten führen wird. Das System muss nahe der Grenze zwischen… organisiert werden.",Tempestades e frio extremo: ciclone extratropical muda o clima no Brasil,Uma frente fria associada à formação de um ciclone extratropical no oceano deve manter a chuva forte na Região Sul nesta quinta-feira (2) e provocar uma mudança brusca no tempo no Sudeste a partir de sexta (3). O sistema deve se organizar próximo à divisa ent…,Storms and extreme cold: extratropical cyclone changes the climate in Brazil. A cold front associated with the formation of an extratropical cyclone in the ocean is expected to maintain heavy rain in the South region this Thursday (2) and cause a sudden change in the weather in the Southeast from Friday (3). The system must be organized close to the border between…,"Tempestates et frigora extrema: cyclo extratropico mutat caelum in Brasilia. Frons frigida cum formatione cyclonis extratropicae in oceano coniungitur, expectatur pluviam in regione meridionali hanc Iovis (2) servare et subitam mutationem in tempestate in Meridiano a die Veneris (3). Systema constituendum est prope terminos inter…",https://www.diariodocentrodomundo.com.br/tempestades-e-frio-extremo-ciclone-extratropical-muda-o-clima-no-brasil/,https://www.diariodocentrodomundo.com.br/wp-content/uploads/2026/07/imagem_2026-07-02_071315870.png,,"Frio na Avenida Paulista, em SP. Foto: reprodução
Uma frente fria associada à formação de um ciclone extratropical no oceano deve manter a chuva forte na Região Sul nesta quinta-feira (2) e provocar… [+3348 chars]",,2026-07-09 17:25:32+00:00,random,,,
a1093950c7d3d5a1b800a49e8adef50a,2026-07-02T20:00:18Z,Cold Wave,queda de temperatura,veja.abril.com.br,pt,0.9,"In São Paulo wird es diesen Freitag, den 3., zu einem Temperaturrückgang kommen; siehe die Climatempo-Prognose. Nach wärmeren Tagen wird es in der Hauptstadt von São Paulo einen neuen Wetterumschwung geben; wissen, ob es regnen wird","São Paulo terá queda de temperatura nesta sexta, 3; veja a previsão do Climatempo","Depois de dias mais quentes, capital paulista terá nova mudança no tempo; saiba se vai chover","São Paulo will see a drop in temperature this Friday, 3rd; see the Climatempo forecast. After warmer days, the capital of São Paulo will have a new change in weather; know if it's going to rain","São Paulo videbit guttam in temperie Veneris die 3; vide Climatempo prospicere. Post calidiores dies, caput São Pauli novam tempestatum mutationem habebit; scire si suus 'pluet",https://veja.abril.com.br/agenda-verde/sao-paulo-tera-queda-de-temperatura-nesta-sexta-3-veja-a-previsao-do-climatempo/,"https://veja.abril.com.br/wp-content/uploads/2019/09/frio-em-sao-paulo.jpg?quality=70&strip=info&resize=1080,565&crop=1",,"Pular para o conteúdo
Oferta Inédita: Assine por apenas 7,99 (Reprodução/Reprodução)
Continua após publicidade
<ul><li>Uma forte massa de ar polar avança sobre o Centro-Sul do Brasil nesta sexta-f… [+4407 chars]",,2026-07-09 17:25:32+00:00,random,,,
a23941b7ac792469d4aae25846a2e4d7,2026-07-03T12:44:29Z,Heat Wave,calor,olhardigital.com.br,pt,0.9,"Zwischen Freitag und Samstag nimmt die Kälte im Süden zu; Im Norden gibt es weiterhin örtliche Regenfälle und im Nordosten herrscht weiterhin trockenes Wetter. Frost, Küstenwinde, starke Hitze und örtlicher Regen schaffen ein Szenario klimatischer Kontraste zwischen den Regionen des Landes
Die Post-Cold gewinnt im Süden zwischen Freitag und Samstag an Stärke; Im Norden kommt es weiterhin zu örtlich begrenzten Niederschlägen und im Nordosten herrscht weiterhin trockenes Wetter, das zuerst auftrat …",Frio ganha força no Sul entre sexta e sábado; Norte mantém chuva localizada e Nordeste segue com tempo seco,"Geadas, ventos costeiros, calor intenso e chuva localizada desenham um cenário de contrastes climáticos entre as regiões do país
O post Frio ganha força no Sul entre sexta e sábado; Norte mantém chuva localizada e Nordeste segue com tempo seco apareceu primei…","Cold gains strength in the South between Friday and Saturday; The North maintains localized rain and the Northeast continues with dry weather. Frosts, coastal winds, intense heat and localized rain create a scenario of climatic contrasts between the country's regions
The post Cold gains strength in the South between Friday and Saturday; North maintains localized rain and Northeast continues with dry weather appeared first…","Frigidum robur obtinet in meridie inter Veneris et Saturni ; Imbrem localem Septentrionalis obtinet et Auster cum siccitate pergit. Pruinae, venti maritimi, aestus intensi et pluviae locales effectae contrarias missiones climaticarum inter regiones patriae creant.
Frigidus post meridiem vires obtinet inter Veneris et Saturni; Septentrionalis pluviam localatam servat et Orientem brumalem continuat cum siccitate visus primus…",https://olhardigital.com.br/2026/07/03/ciencia-e-espaco/frio-ganha-forca-no-sul-entre-sexta-e-sabado-norte-mantem-chuva-localizada-e-nordeste-segue-com-tempo-seco/,https://olhardigital.com.br/wp-content/uploads/2025/08/geada.jpg,,"A chegada de uma frente fria altera as condições do tempo em diferentes áreas do Brasil entre sexta-feira (3) e sábado (4), com queda acentuada das temperaturas no Sul, avanço da friagem para parte d… [+5095 chars]",,2026-07-09 17:25:32+00:00,random,,,
35f3243838a8d6dfaef70d4272546cbc,2026-07-04T13:46:26Z,Snow&Ice,geada,www.terra.com.br,pt,0.9,Kalte Luftmassen lassen die Temperaturen sinken und im Süden herrscht Frostwarnung; siehe Prognose. RS und SC haben eine orangefarbene Frostwarnung; Im Südosten werden für Montag Tiefsttemperaturen von 6°C bis 8°C vorhergesagt,Massa de ar frio derruba temperaturas e Sul tem alerta para geadas; veja previsão,"RS e de SC têm alerta laranja para geadas; No Sudeste, mínimas previstas para segunda-feira são de 6°C a 8°C","Mass of cold air drops temperatures and the South has a warning for frost; see forecast. RS and SC have an orange alert for frost; In the Southeast, minimum temperatures forecast for Monday are 6°C to 8°C","Massa frigoris aeris imbres temperaturae et Austri pruinis monitionem habet; see auguror. RS et SC aurantii habent erectum ad pruinam; In Southeast, minimum temperaturas praecognoscendum Lunae sunt 6°C ad 8°C","https://www.terra.com.br/planeta/noticias/massa-de-ar-frio-derruba-temperaturas-e-sul-tem-alerta-para-geadas-veja-previsao,5ec25ad6f1f27059b121e707f305eb4504by2lbm.html",https://p2.trrsf.com/image/fget/cf/1200/630/middle/images.terra.com/2026/07/04/1790713165-mf5bnoszyzcx7c44qu46ymteom.jpeg,,"Uma massa de ar polar chegou ao País neste sábado, 4, e derrubou temperaturas, principalmente na região Sul. Ao longo do dia, ventos fortes devem atingir a costa do Rio Grande do Sul e de Santa Catar… [+2492 chars]",,2026-07-09 17:25:32+00:00,random,,,
5dde3a6a9aa6221c3f45d46361d57f91,2026-07-02T21:30:19Z,Drought,seca moçambique,pplware.sapo.pt,pt,0.3,"Sun startete neuen koronalen Massenauswurf. In den kommenden Tagen besteht die Möglichkeit von Polarlichtern. Die Sonne bleibt sehr aktiv und hat erneut einen starken koronalen Massenauswurf (CME) ausgelöst, ein Phänomen, das die geomagnetische Aktivität der Erde in den kommenden Tagen verstärken könnte. Obwohl der Auswurf nicht...",Sol lançou nova ejeção de massa coronal. Há possibilidade de auroras nos próximos dias,"O Sol continua bastante ativo e voltou a lançar uma poderosa ejeção de massa coronal (CME), um fenómeno que poderá aumentar a atividade geomagnética da Terra nos próximos dias. Apesar de a ejeção não...","Sun launched new coronal mass ejection. There is a possibility of auroras in the coming days. The Sun remains very active and has once again launched a powerful coronal mass ejection (CME), a phenomenon that could increase Earth's geomagnetic activity in the coming days. Although the ejection did not...","Sol novam massam coronalem eiectionem emisit. Est auroras possibilitas in adventu dierum. Sol acerrimus manet et validam molem coronalem eiectionis (CME), phaenomenon, quod augere potuit actio geomagnetica Telluris in diebus futuris. Etiam eie neque...",https://pplware.sapo.pt/ciencia/sol-lancou-nova-ejecao-de-massa-coronal-ha-possibilidade-de-auroras-nos-proximos-dias/,https://pplware.sapo.pt/wp-content/uploads/2026/07/ataque_solar00.webp,,"O Sol continua bastante ativo e voltou a lançar uma poderosa ejeção de massa coronal (CME), um fenómeno que poderá aumentar a atividade geomagnética da Terra nos próximos dias.
Apesar de a ejeção nã… [+5601 chars]",,2026-07-10 04:05:44+00:00,edo,Mozambique,ESAF,Africa
cba7fbb8cbc1f846a6d36a35f505fa0a,2026-07-05T08:42:37Z,Storm,tempestade,www.terra.com.br,pt,0.9,"England kehrt 40 Jahre nach dem Versuch von „La Mano de Dios“, Mexikos Schwung bei der Weltmeisterschaft zu bremsen, nach Azteca zurück. Besorgnis über die Höhenlage von Mexiko-Stadt und die Möglichkeit von Stürmen lösen ein Duell aus, das auf Brasiliens möglichen Rivalen im Viertelfinale schließen lässt",Inglaterra volta ao Azteca 40 anos após 'La Mano de Dios' tentando frear embalo do México na Copa,Preocupação com altitude da Cidade do México e possibilidade de tempestade agitam duelo que indica possível rival do Brasil nas quartas de final,England returns to Azteca 40 years after 'La Mano de Dios' trying to stop Mexico's momentum in the World Cup. Concern about Mexico City's altitude and the possibility of storms stir up a duel that indicates Brazil's possible rival in the quarterfinals,Anglia ad Aztecam redit post XL annos 'La Mano de Dios' momentum Mexici in Trophaeo Mundi prohibere conatur. Sollicitudo circa altitudinem urbis Mexici et tempestatum possibilitatem excitant duellum quod indicat possibilem aemulum Brasiliae in quarterfinalibus.,"https://www.terra.com.br/esportes/futebol/inglaterra-volta-ao-azteca-40-anos-apos-la-mano-de-dios-tentando-frear-embalo-do-mexico-na-copa,d0193d7a93c9afcf707ce6a8b80423ea2iw9sh7d.html",https://s1.trrsf.com/update-1698692222/fe/zaz-mod-t360-icons/svg/logos/terra-16x9-borda.png,,"A bola mal afastada por Hodge toma efeito e sobe dentro da área para Maradona disputá-la pelo alto com Peter Shilton. Bem mais baixo (diferença de 20 centímetros), o astro desvia com a mão esquerda p… [+4635 chars]",,2026-07-11 03:32:33+00:00,random,,,
e5b3d92093575ee5035c400919b17af3,2026-07-08T07:13:14Z,Precipitation,chuva torrencial costa rica,observador.pt,pt,0.3,Mehr als 80 Gemeinden in höchster Gefahr; 7 Bezirke in Orange. Die Warnung vor maximaler ländlicher Brandgefahr galt für rund hundert Gemeinden. Aufgrund der anhaltend hohen Temperaturen gilt für sieben Bezirke außerdem die Warnstufe Orange.,Mais de 80 concelhos em perigo máximo; 7 distritos a laranja,O aviso de perigo máximo de incêndio rural foi aplicado a cerca de uma centena de concelhos. A persistência das temperaturas elevadas colocou ainda sete distritos sob aviso laranja.,More than 80 municipalities in maximum danger; 7 districts in orange. The maximum rural fire danger warning was applied to around a hundred municipalities. The persistence of high temperatures also placed seven districts under orange warning.,Plusquam 80 municipia in maximo periculo sunt; 7 districtus aurei. Maximum periculum rusticum incendium ad centum municipia monendum applicatum est. Pervicacia temperaturae altae septem regiones sub monitione aurantiaca collocavit.,https://observador.pt/2026/07/08/mais-de-80-concelhos-em-perigo-maximo-sete-distritos-sob-aviso-laranja/,https://wm.observador.pt/wm/l/https%3A%2F%2Fbordalo.observador.pt%2Fv2%2Frs%3Afill%3A770%3A403%2Fc%3A2025%3A1138%3Anowe%3A0%3A106%2Fq%3A70%2Ff%3Awebp%2Fplain%2Fhttps%3A%2F%2Fs3.observador.pt%2Fwp-content%2Fuploads%2F2026%2F07%2F03205834%2Fgco-dincendio-vouzela-3-julho-2026-028.jpg?layer=obstop:T,,"Mais de 80 concelhos de 14 distritos de Portugal continental estão esta quarta-feira em perigo máximo de incêndio rural, segundo o Instituto Português do Mar e da Atmosfera (IPMA). De entre estes 14 … [+2328 chars]",,2026-07-11 11:14:06+00:00,wmo,Costa Rica,SCA,North-America
941231816952381a9a042eb27c2e0d26,2026-07-02T16:43:43Z,Earthquake,terremoto,www.bbc.com,pt,0.9,"Herzzerreißende Rettung eines Erdbebenüberlebenden, der nach acht Tagen in Venezuela aus den Trümmern geborgen wurde. Hernán Gil wurde eingeklemmt, als ein mehrstöckiges Parkhaus einstürzte. Er leitete die Retter an und spielte mit ihnen während der Rettungsarbeiten",O resgate emocionante de sobrevivente de terremoto retirado de escombros após oito dias na Venezuela,Hernán Gil ficou preso quando um edifício de estacionamento de vários andares desabou. Ele orientou os socorristas e brincava com eles durante os trabalhos de resgate,Heartbreaking rescue of earthquake survivor pulled from rubble after eight days in Venezuela. Hernán Gil was trapped when a multi-story parking building collapsed. He guided rescuers and played with them during rescue work,Misericordiae liberandae terrae motus superstes e ruderibus post octiduum in Venezuela extraxerunt. Hernán Gil deprehensus est cum multi-fabulam raedam aedificii corruerunt. Salvatores deduxit cum eis in opere liberavit et lusit,https://www.bbc.com/portuguese/articles/ckg7ed8y3x6o,https://ichef.bbci.co.uk/news/1200/branded_portuguese/eee2/live/1e6d2850-761f-11f1-8c8c-f987daa96c22.jpg,,"Legenda do vídeo, Assista: homem resgatado vivo dos escombros, oito dias após o duplo terremoto na Venezuela
Article Information<ul><li><ul><li>Author, Vanessa Buschschlüter </li><li>Role, Editora d… [+4199 chars]",,2026-07-11 16:02:22+00:00,random,,,
ef713b0e393538b901edfcc75283cfef,2026-07-04T03:07:24Z,Earthquake,terremoto,www.terra.com.br,pt,0.9,"Cristiano Ronaldo bewegt Erdbeben-Überlebenden mit Video und Versprechen. Andrés‘ Wunsch nach einem Aufkleber für das WM-Album wird zu einer besonderen Einladung, sich das Spiel des portugiesischen Stars anzusehen",Cristiano Ronaldo emociona sobrevivente de terremoto com vídeo e promessa,Pedido do garoto Andrés por figurinha de álbum da Copa vira convite especial para ver jogo do astro português,Cristiano Ronaldo moves earthquake survivor with video and promise. Andrés' request for a World Cup album sticker turns into a special invitation to watch the Portuguese star's game,Cristiano Ronaldo superstes terrae motus cum video et promissione movet. Petitio Andrés pro Calicem Mundi album obice vertit in singularem invitationem ad spectandum lusus astri Lusitani.,"https://www.terra.com.br/esportes/venezuela/cristiano-ronaldo-emociona-sobrevivente-de-terremoto-com-video-e-promessa,5f26a8857e4850ba8143aa02bcffd6dbng67pt7e.html",https://p2.trrsf.com/image/fget/cf/1200/630/middle/images.terra.com/2026/07/04/1535138313-captura-de-tela-2026-06-23-172221easy-resizecom-610x400.jpg,,"Nesta sexta-feira (3), um dia após Portugal garantir vaga nas oitavas de final da Copa do Mundo, Cristiano Ronaldo voltou a emocionar seus fãs ao enviar uma mensagem especial. O craque português grav… [+1874 chars]",,2026-07-11 16:02:22+00:00,random,,,
9515e60d3e2e0c1ee6eecd2388ec8dea,2026-07-02T21:22:27Z,Heat Wave,onda de calor luxemburgo,www.terra.com.br,pt,0.3,"Nachgerüstet: der neue „Stift“, der Mounjaro zu übertreffen verspricht und für Susana Werner zu einer umstrittenen Wahl wurde. Die Geschäftsfrau überraschte das Internet, indem sie die Anwendung von Retatrutida vorführte, einem innovativen Molekül, das 32 kg abnimmt, aber weltweit immer noch illegal verkauft wird","Retatrutida: a nova ""caneta"" que promete superar o Mounjaro e virou escolha polêmica de Susana Werner","A empresária surpreendeu a web ao exibir aplicação de retatrutida, uma molécula inovadora que emagrece 32 kg mas que ainda é ilegal para a venda no mundo todo","Retrofitted: the new ""pen"" that promises to surpass Mounjaro and became a controversial choice for Susana Werner. The businesswoman surprised the web by showing off the application of retatrutida, an innovative molecule that loses 32 kg but is still illegal for sale worldwide","Retrofitta est: novus ""stylus"" qui promittit Mounjaro antecedere et factus est controversiae electio in Susana Werner. Negotiatrix miratur telam applicatione retatrutidarum ostentando, moleculae novationis quae 32 kg amittit, sed adhuc per orbem terrarum pro venditione illicita est.","https://www.terra.com.br/vida-e-estilo/retatrutida-a-nova-caneta-que-promete-superar-o-mounjaro-e-virou-escolha-polemica-de-susana-werner,f7523245396614124b838bec9e07c6ce00hgdutd.html",https://p2.trrsf.com/image/fget/cf/1200/630/middle/images.terra.com/2026/07/02/378586692-capa-bons-fluidos-12-1.jpg,,"A busca pelo corpo ideal ganhou um novo e polêmico capítulo no mundo das celebridades. Recentemente, a empresária Susana Werner movimentou as redes sociais ao compartilhar o início de um tratamento d… [+3949 chars]",,2026-07-12 07:33:52+00:00,wmo,Luxembourg,WCE,Europe
b0ba83e32baf798739bc678d4fc7a79b,2026-07-03T21:44:46Z,Cold Wave,temperatura mínima mais baixa,www.mdig.com.br,pt,0.3,"Der schlüssige Grund, warum Alkohol nicht verboten werden kann. Es verursacht jedes Jahr fast 3 Millionen Todesfälle. Es ist für 200 verschiedene Krankheiten verantwortlich. Und wenn es heute entdeckt würde, würden moderne Sicherheitsstandards es mit ziemlicher Sicherheit als illegale Droge einstufen. Allerdings kann man es im Supermarkt kaufen…",A coerente razão pela qual o álcool não pode ser proibido,"Ele causa quase 3 milhões de mortes todos os anos. É responsável por 200 doenças diferentes. E, se fosse descoberto hoje, os padrões modernos de segurança quase certamente o classificariam como uma droga ilegal. No entanto, você pode comprá-lo no supermercado…","The coherent reason why alcohol cannot be banned. It causes nearly 3 million deaths every year. It is responsible for 200 different diseases. And if it were discovered today, modern safety standards would almost certainly classify it as an illegal drug. However, you can buy it in the supermarket…","Cohaerens ratio cur alcohol damnari non potest. Fere 3 decies centena milia mortum facit omni anno. CC diversis morbis est responsalis. Et si hodie deprehensa esset, signa salutis hodiernae illam quasi medicamento illicito fere certo indicarent. Tamen in macellum emere potes...",https://www.mdig.com.br/index.php?itemid=61272,https://imagens.mdig.com.br/historia/lei_seca_1920.jpg,,"<table><tr><td></td><td>Ele causa quase 3 milhões de mortes todos os anos. É responsável por 200 doenças diferentes. E, se fosse descoberto hoje, os padrões modernos de segurança quase certamente o c… [+8721 chars]",,2026-07-12 07:33:52+00:00,random,,,
98ed4b99736284c02696f93e4749875a,2026-07-03T21:59:48Z,Drought,seca Nicarágua,www.bbc.com,pt,0.3,"Flávios Reise in die USA sei ein Versuch, sich von der Verantwortung für Zölle zu befreien, sagt Lulas Minister. Minister of Development, Industry, Commerce and Services, Márcio Elias Rosa, tells the BBC that the government is also trying to reach an agreement to postpone the entry into force of the new American tariffs","Viagem de Flávio aos EUA é tentativa de se livrar de responsabilidade por tarifaço, diz ministro de Lula","Ministro do Desenvolvimento, Indústria, Comércio e Serviços, Márcio Elias Rosa, diz à BBC que governo também tenta costurar acordo para adiar entrada em vigor das novas tarifas americanas","Flávio's trip to the USA is an attempt to free himself from responsibility for tariffs, says Lula's minister. Minister of Development, Industry, Commerce and Services, Márcio Elias Rosa, tells the BBC that the government is also trying to reach an agreement to postpone the entry into force of the new American tariffs","Flavio iter in USA est conatum se ab officiis pro portoriis liberare, minister Lula dicit. Minister Progressionis, Industrie, Commercii et Services, Márcio Elias Rosa, BBC indicat regimen etiam concordiae dilatare ingressum in vim novae portoriorum Americanorum conari.",https://www.bbc.com/portuguese/articles/cvglzxjl084o,https://ichef.bbci.co.uk/news/1200/branded_portuguese/b008/live/47c76390-7729-11f1-b976-0b9c15b0ccfc.jpg,,"Crédito, EPA
Article Information<ul><li><ul><li>Author, Leandro Prazeres</li><li>Role, Da BBC News Brasil em Brasília</li></ul></li><li></li><li></li></ul>
Às vésperas do fim do prazo de consultas … [+16139 chars]",,2026-07-12 07:33:52+00:00,edo,Nicaragua,SCA,North-America
1d03d63058084ca959c7f818fd3c75f8,2026-07-06T19:34:12Z,Tropical Cyclone,tempestade tropical,flatout.com.br,pt,0.3,"Troll: der erste (und einzige) in Norwegen hergestellte Sportwagen. Das Wort Troll hat verschiedene Bedeutungen. Ursprünglich sind Trolle Wesen aus der Mythologie der nordischen Länder – hässliche, zurückgezogene Wesen, die selten mit Menschen auskommen und in Höhlen, Wäldern oder unter Brücken leben, die sie selbst geschaffen haben.",Troll: o primeiro (e único) esportivo feito na Noruega,"A palavra troll tem alguns significados diferentes. Originalmente, trolls são criaturas da mitologia dos países nórdicos — seres feios e reclusos que raramente se dão bem com seres humanos e vivem em cavernas, florestas ou debaixo de pontes que eles mesmos co…","Troll: the first (and only) sports car made in Norway. The word troll has a few different meanings. Originally, trolls are creatures from the mythology of Nordic countries — ugly, reclusive beings who rarely get along with humans and live in caves, forests or under bridges that they themselves create.","Troglodytarum: primus (et solus) currus ludis in Norvegia factis. Verbum Troglodytarum paucas significationes habet. Primitus troglodytae creaturae sunt ex mythologia nationum Nordicorum — entia deformia, reclusiva, quae raro cum hominibus coniunguntur et in speluncis, silvis vel sub pontibus vivunt, quos ipsi creant.",https://flatout.com.br/troll-o-primeiro-e-unico-esportivo-feito-na-noruega/,https://cdn.flatout.com.br/wp-content/uploads/2026/07/troll-e1783365370557.png,,a palavra troll tem alguns significados diferentes  originalmente  trolls sao criaturas da mitologia dos paises nordicos  seres feios e reclusos que raramente se dao bem com seres humanos e vivem em … [+23641 chars],,2026-07-12 07:33:52+00:00,random,,,
a3d611f830df358adfc8a97de5deb12a,2026-07-01T14:34:05Z,Earthquake,terremoto venezuela,www.bbc.com,pt,0.9,"Tausende Tote, Millionen hilfsbedürftige Menschen: Die Zahlen verdeutlichen das Ausmaß der Tragödie nach den Erdbeben in Venezuela. Daten venezolanischer Behörden und internationaler Organisationen über die Auswirkungen der Katastrophe zeichnen ein zunehmend ernstes Bild.","Milhares de mortos, milhões precisando de ajuda: os números que mostram a dimensão da tragédia após terremotos na Venezuela",Dados das autoridades venezuelanas e de organizações internacionais sobre o impacto da catástrofe pintam um quadro cada vez mais grave.,"Thousands dead, millions in need of help: the numbers that show the scale of the tragedy following earthquakes in Venezuela. Data from Venezuelan authorities and international organizations on the impact of the catastrophe paint an increasingly serious picture.","Milia mortuorum, decies centena milia egent auxilio: numeri qui ostendunt scalam tragoediae sequentes terrae motus in Venezuela. Data apud Venezuelan auctoritates et Instituta internationalia ob calamitatis impulsum imaginem magis magisque gravem pingunt.",https://www.bbc.com/portuguese/articles/cx23d31gyx4o,https://ichef.bbci.co.uk/news/1200/branded_portuguese/75de/live/0b98f430-74fc-11f1-812a-0bedfce7705b.jpg,,"Crédito, Reuters
Legenda da foto, Familiares e vizinhos de Jhonquer Cerpas, um menino de 13 anos que foi resgatado dos escombros
Article Information<ul><li><ul><li>Author, Santiago Vanegas</li><li>… [+7369 chars]",,2026-07-12 07:33:52+00:00,usgs,Venezuela,NSA,South-America
